work_id,title,author,warnings,rating,category,fandom,relationship,character,additional tags,language,published,status,status date,words,chapters,comments,kudos,bookmarks,hits,summary
15776985,Street Lights,/users/gardengalaxy/pseuds/gardengalaxy,Creator Chose Not To Use Archive Warnings,Teen And Up Audiences,Gen,"Transformers - All Media Types, Transformers: Prime",,"OC - Character, OFC, Breakdown (Transformers), Knock Out (Transformers), Starscream (Transformers), Soundwave (Transformers), Original Vehicon Character(s), Vehicon(s) (Transformers)","Pansexual Character, autistic protagonist, Biracial Character, character with a hearing disability, yep, she is all of those things, I am proud of her, BAMF Women, she starts a revolution, vehicons with twitter accounts, she also really does not like megatron",English,2018-08-23,Completed,2018-08-23,2925,1/1,5,14,1,85,"Noticing how the humans were able to provide aid to the Autobots, Megatron orders Breakdown to acquire one (preferably without being noticed) from Earth to further decepticon knowledge.It goes about as well as you'd expect.Pissed at being snatched from her comfy bed sleeping on the streets, Lee cracks her knuckles and begins planning the revolution."
15776979,Dinner with a Stranger,/users/Goodnightwife/pseuds/Goodnightwife,"Creator Chose Not To Use Archive Warnings, No Archive Warnings Apply",Teen And Up Audiences,F/M,"Real Person Fiction, British Actor RPF, Tom Hiddleston - Fandom",Tom Hiddleston/Reader,"Tom Hiddleston, Reader, Tom Hiddleston Fluff","Hiddlestoner Fluff, Kissing",English,2018-08-23,Completed,2018-08-23,5119,1/1,2,27,1,431,"Y/N gets lost in London during her ""alone-cation"" and bumps into a more than helpful Tom Hiddleston."
15776976,Lost and Found,/users/IronScript/pseuds/IronScript,Graphic Depictions Of Violence,Teen And Up Audiences,"Gen, M/M",Voltron: Legendary Defender,Keith/Lance (Voltron),"Luis (Voltron), Lance (Voltron), Veronica (Voltron), Lance's Family (Voltron), Other Characters Mentioned But Not Present","Post Season 7, Spoilers, inner musings, brief mentions of attempted non-con, Lance saved her don't worry, Bisexual Lance (Voltron), Pining Lance (Voltron), diplomat lance, BAMF Lance (Voltron), pre-relationship klance, feel free to ignore if it's not your cup of tea, Lance (Voltron) Has ADHD, Lance is a smart cookie, Lance is super considerate, his family is so proud of him, does include some hopefully realistic angst",English,2018-08-23,Completed,2018-08-23,2088,1/1,11,188,22,1089,"Luis McClain reflects on the man Lance has become, and realized that despite their family's worries, he is exactly where he's meant to be."
15776973,Kitten On The Loose,/users/Avynn_Marie/pseuds/Avynn_Marie,Creator Chose Not To Use Archive Warnings,Not Rated,,Sons of Anarchy,,"Juice Ortiz, Tig Trager, Half-Sack Epps, Clay Morrow, Bobby Munson","Kittens, Fluff, Feels",English,2018-08-23,Completed,2018-08-23,389,1/1,4,14,null,72,"Sons Of Anarchy  - Juice One Shot request from my Tumblr ""How about Juice volunteers to foster kittens."" uh...how about YES!"
15776964,Am I Ever On Your Mind?,/users/IfWallsCouldMuke/pseuds/OnJadleyMind,No Archive Warnings Apply,Explicit,M/M,The Vamps (UK Band),James McVey/Brad Simpson,,"Exes, Emotional Sex, Emotional Hurt/Comfort, promise rings, Marriage Proposal, Drabble, Smut, Fluff and Smut, Sad with a Happy Ending, Epilogue",English,2018-08-23,Completed,2018-08-23,904,1/1,null,1,null,18,"“James…” “I’m sorry,” James apologises when his ex silently creeps closer to him in their studio. “I was such a fool to—” “I forgive you,” Brad is sat on James lap, like they used to be used to when the band first kicked off. “I miss you too.” “You’re the only damn thing that kept me same over the years,” James’ treacherous hands seem to remember how it feels to have themselves poised on Brad’s hips. “I love loving you…” ‴Higher,‴ tears glisten in Brad’s beauteous doe-brown eyes. “I took you higher.” “Never stopped,” James replies. I wanna kiss you…   Or, a On Your Mind inspired fic."
15776961,Hellhound,/users/Avynn_Marie/pseuds/Avynn_Marie,Graphic Depictions Of Violence,Not Rated,,Supernatural,"Dean Winchester/Original Female Character(s), Dean Winchester/You, Dean Winchester/Reader","Dean Winchester, Sam Winchester, Castiel (Supernatural)","Protective Dean Winchester, Blood and Violence, Hellhounds, Near Death Experiences",English,2018-08-23,Completed,2018-08-23,1597,1/1,null,12,null,173,Supernatural One Shot / I believe the tags and title are self explanitory
15776958,there can(not) only be one,/users/TheTartWitch/pseuds/TheTartWitch,Major Character Death,Teen And Up Audiences,Gen,Fire - Kristin Cashore,"Fire & OMC, Fire & Cansrel, OMC & Cansrel, Hanna & OMC","Fire - Character, Cansrel, OMC, Hanna, Blotchy the dog, Queen Roen, Prince Brigan, Prince Nash, Princess Clara","Cansrel dies later, Fire has a twin, mindmeld, Alternate Universe - Canon Divergence, let me know if you think this needs more tags",English,2018-08-23,Completed,2018-08-23,3504,1/1,null,3,null,5,Bren has always been there for Fire.
15776955,Confessions,/users/ButWhatIfImagines/pseuds/ButWhatIfImagines,No Archive Warnings Apply,General Audiences,"F/M, Gen",Overwatch (Video Game),"Jesse McCree/Reader, Jesse McCree & Reader","Jesse McCree, Reader","Pre-Fall of Overwatch, Pre-Relationship, Confessions, Fluff",English,2018-08-23,Completed,2018-08-23,1182,1/1,6,37,4,310,"You and Jesse sometimes spend evenings stargazing at Overwatch HQ. Tonight, you're feeling a little more plucky than usual, and make a confession."
15776940,When Lily Met Lily,/users/The_Carnivorous_Muffin/pseuds/The_Carnivorous_Muffin,No Archive Warnings Apply,Teen And Up Audiences,Gen,Harry Potter - J. K. Rowling,,"Harry Potter, Tom Riddle | Voldemort","Family, Friendship, Humor, Time Travel, Female Harry Potter, Master of Death Harry Potter, Alternate Universe, Time Travel Fix-It",English,2018-08-23,Completed,2018-08-23,2571,1/1,null,8,2,65,"After her disastrous, and rather fuzzy, confrontation with Trotsky in 1992, Lily finds herself vaulted back into Little Whinging six years earlier, to a time and place where Lily and Wizard Lenin had only just met and have everything still before them. Naturally, she decides advice is warranted."
15776931,"Silence, and Other Too-Loud Things",/users/natashawrites/pseuds/natashawrites,No Archive Warnings Apply,Teen And Up Audiences,M/M,Voltron: Legendary Defender,Keith/Lance (Voltron),"Keith (Voltron), Lance (Voltron)","Lance: Mother Hen, Keith: Self-Destructive Boi, Fluff and Angst, Angst - Troubled Past, hiking and storms don't mix well, First Kiss, Klance origin story, Getting to Know Each Other, Strangers to Lovers (Implied), Klance Oneshot AU",English,2018-08-23,Completed,2018-08-23,4169,1/1,4,94,9,544,"The hiker is saying something, Keith realizes, but he can’t hear what over the sound of rolling thunder, right over their heads now. He focuses on lips, lips with a cupid’s bow dripping rain, lips that look moisturized and soft and that are still talking to him - “Are you even listening to me?” The hiker’s voice finally breaks through the storm both in and out of Keith’s head. Keith shakes his head, trying to clear the familiar fog there, trying to focus on the man in front of him, so unexpected and yet probably well-meaning. “I can hear you now.” ((Or, a fic in which Lance saves Keith in more ways than one.))"
15776934,Don't Mess With Tig's Girl,/users/Avynn_Marie/pseuds/Avynn_Marie,Creator Chose Not To Use Archive Warnings,Not Rated,F/M,Sons of Anarchy,"Tig Trager/Reader, Tig Trager/Original Female Character(s)",Tig Trager,"protective tig, protective tig trager",English,2018-08-23,Completed,2018-08-23,1483,1/1,1,10,2,111,Protective Tig One Shot request from my Tumblr
15776928,Home,/users/danithemani/pseuds/danithemani,Rape/Non-Con,Mature,"M/M, Other","Fallout 4, Fallout (Video Games)",Male Sole Survivor/Original Male Character(s),Male Sole Survivor,"Incest, Parent/Child Incest, Psychological Trauma, Past Rape/Non-con, Father/Son Incest, Stockholm Syndrome, Dead Dove: Do Not Eat, Implied Sexual Content",English,2018-08-23,Completed,2018-08-23,851,1/1,null,5,null,157,"Dante comes home on leave per Father's request. Takes place before the events of Fallout 4 and before Shaun's birth. Super triggery, please read with care. ♤Song inspiration is Angel of Small Death and the Codeine Scene by Hozier♡"
15776925,Long Overdue,/users/BeStillMySlashyHeart/pseuds/BeStillMySlashyHeart,No Archive Warnings Apply,Teen And Up Audiences,M/M,Animal Kingdom (TV),Adrian/Deran Cody,"Deran Cody, Adrian (Animal Kingdom)",Fluff and Angst,English,2018-08-23,Completed,2018-08-23,2908,1/1,7,88,7,843,"Deran bails Adrian out of jail because of course he does. Afterwards, the boys have a long overdue conversation. Adrian POV"
15776919,Kiss with a Fist,/users/Kaddi/pseuds/Kaddi,No Archive Warnings Apply,Teen And Up Audiences,M/M,Granblue Fantasy (Video Game),Feather/Gran (Granblue Fantasy),"Gran (Granblue Fantasy), Feather (Granblue Fantasy)","Fluff, pure fluff, this is not the valentine's fic i've been meaning to write, gran tries to confess",English,2018-08-23,Completed,2018-08-23,230,1/1,null,20,null,null,Gran finally agrees to talk with Feather.
15776916,The Pit of Man's Fear and the Summit of his Knowledge,/users/The_Carnivorous_Muffin/pseuds/The_Carnivorous_Muffin,No Archive Warnings Apply,Teen And Up Audiences,F/M,Harry Potter - J. K. Rowling,Harry Potter/Original Male Character(s),"Harry Potter, Original Male Character(s)","Horror, Suspense, Mystery, Female Harry Potter, Master of Death Harry Potter, Alternate Universe",English,2018-08-23,Completed,2018-08-23,2172,1/1,null,4,1,57,"Once, perhaps, Rabbit ate Scotland."
15776913,Your saving scent,/users/Levi_ah/pseuds/Free%20Spirit,Creator Chose Not To Use Archive Warnings,Teen And Up Audiences,M/M,GOT7,Im Jaebum | JB/Park Jinyoung | Jr.,"Im Jaebum | JB, Park Jinyoung | Jr., Mark Tuan, Kim Yugyeom","Fluff, Alpha/Beta/Omega Dynamics, Alternate Universe - College/University, Sweet, A little angst",English,2018-08-23,Completed,2018-08-23,2131,1/1,10,101,3,797,Jinyoung attents a college party and the evening takes its course.
15776904,All is Fair,/users/ZenlessZen/pseuds/ZenlessZen,Major Character Death,Not Rated,M/M,Persona 5,Akechi Goro/Kurusu Akira,"Akechi Goro, Kurusu Akira",Angst,English,2018-08-23,Completed,2018-08-23,1140,1/1,9,16,1,184,"Criminals in the end, are met with Justice"
15776889,Help You Fix It,/users/GabrielLives/pseuds/GabrielLives,No Archive Warnings Apply,General Audiences,F/M,Supernatural,"Gabriel/Reader, Gabriel (Supernatural)/You","Gabriel (Supernatural), Reader, You","after a hunt, No Blood, but you gotta sew yourself a little, Hurt/Comfort, Emotional Hurt/Comfort, First Kiss, Pre Relationship",English,2018-08-23,Completed,2018-08-23,1151,1/1,2,20,2,258,Gabriel is pissed that the reader is reckless on a hunt.
15776877,vox nihili,/users/corvus_corvus/pseuds/corvus_corvus,No Archive Warnings Apply,Teen And Up Audiences,F/M,Bleach,Kuchiki Rukia/Kurosaki Ichigo,,"Pre-686, Marriage, Could Be Canon, mostly canon compliant, Angst, lots of feelings, Awful Latin Titles",English,2018-08-23,Completed,2018-08-23,3078,1/1,null,5,null,97,“I figured a first and last kiss couldn’t hurt.”
15776874,When I fell in love with you...,/users/Zwiezraczek/pseuds/Zwiezraczek,Creator Chose Not To Use Archive Warnings,Not Rated,M/M,Voltron: Legendary Defender,"Kinkade & Lance (Voltron), Kinkade/Lance (Voltron)","Kinkade (Voltron), Lance (Voltron), James Griffin (Voltron)","Fluff, pining Kinkade, Asexual Kinkade, Canon Universe, sharpshooters, Friends to Lovers, I wanted them to be fluffy all the way, and Kinkade being an adorable human being, and Lance loving him so much, aaaah this pairing will kill me one day",English,2018-08-23,Completed,2018-08-23,2432,1/1,4,110,8,939,"Ryan wasn't the type of guy to fall in love, he fell in love once and it broke his heart so he never wanted to love, to trust, to care. But this time, everything struck him as fast as it could, maybe not like the first time by developing a crush, by trying to figure out what was happening to him at the moment because now he knew: Ryan fell for him like he never did."
15776868,Double Trouble,/users/Boogiepopular/pseuds/Boogiepopular,Rape/Non-Con,Explicit,M/M,Pu nohiroakademia | Boku no Hero Academia | My Hero Academia,Aizawa Shouta | Eraserhead/Yamada Hizashi | Present Mic,"Aizawa Shouta | Eraserhead, Yamada Hizashi | Present Mic","Threesome - M/M/M, villain!aizawa, Self-cest, Rape/Non-con Elements",English,2018-08-23,Completed,2018-08-23,3539,1/1,20,75,7,912,Hizashi and Shouta are captured by a villainous version of Shouta from another world.
15776862,Devil on My Shoulder,/users/The5thDimension/pseuds/The5thDimension,No Archive Warnings Apply,General Audiences,Gen,"World Wrestling Entertainment, Professional Wrestling",,"Becky Lynch | Rebecca Knox, Alexa Bliss","Angst, Friendship, Betrayal",English,2018-08-23,Completed,2018-08-23,1013,1/1,3,9,null,92,"Minutes after attacking her former best friend, Becky finds herself conflicted. Luckily for her, the devil on her shoulder is there to set her straight."
15776856,"See, This is What I Meant",/users/Zane_Takeshi/pseuds/Zane_Takeshi,No Archive Warnings Apply,Teen And Up Audiences,M/M,Fairy Tail,"Natsu Dragneel/Gray Fullbuster, Gray Fullbuster/Lisanna Strauss (One-Sided)","Gray Fullbuster, Natsu Dragneel, Lisanna Strauss, Lucy Heartfilia, Erza Scarlet, Happy (Fairy Tail), Mirajane Strauss, Cana Alberona","One-Sided Attraction, Lisanna doesn't like to listen, Gray believes what he wants, Natsu is using this to his own amusement, Humor, Happy writing anniversary mdelpin, FTLGBTales, Gift Fic, Natsu is a little shit, Boys In Love",English,2018-08-23,Completed,2018-08-23,1571,1/1,6,21,2,223,"Natsu tries to tell Lisanna that Gray is already interested in someone while also telling Gray that Lisanna likes him. Neither of them believes what Natsu has to say, because why would they when they 'know' the truth? Natsu decides to help the situation along, for his own amusement, of course."
15776853,Together,/users/DingleLovesSugdenAlways/pseuds/DingleLovesSugdenAlways,"Creator Chose Not To Use Archive Warnings, No Archive Warnings Apply",Not Rated,,"Emmerdale, robron, Roblivion - Fandom",Roblivion Robron Emmerdale,"Aaron Dingle, Robert Sugden, Liv Flaherty","GCSE Results, Talking, Family, self doubt",English,2018-08-23,Completed,2018-08-23,935,1/1,3,19,null,267,Aaron and Robert go to talk to Liv after they forgot about her GCSE Results.
15776847,Almost Fate,/users/riverdale1113/pseuds/riverdale1113,Creator Chose Not To Use Archive Warnings,Mature,Other,Riverdale - Fandom,"Betty Cooper/Jughead Jones, Betty Cooper & Jughead Jones","Toni Topaz, Jughead Jones, Betty Cooper, Sweet Pea, Kevin Keller, Cheryl Blossom, Veronica Lodge","teacher, School, Developing Relationship, Cuddle, hjssnbsbd, im just adding random stuff, bughead - Freeform, choni",English,2018-08-23,Completed,2018-08-23,379,1/1,null,11,null,339,"Betty Cooper has been the English teacher at Riverdale since she got out of college. When the new history teacher is assigned to do a project with her, an old love gets a new meaning."
15776832,Thinking of you,/users/Olliekun/pseuds/Olliekun,Major Character Death,Teen And Up Audiences,,"Persona 5, Persona Series",Akechi Goro/Kurusu Akira (one-sided),"Kurusu Akira, Sakura Futaba, Morgana (Persona 5), Okumura Haru, Sakamoto Ryuji","first fanfic in four years, Im nervious and weak, Grief/Mourning, This is badly written im warning you, Spoilers",English,2018-08-23,Completed,2018-08-23,1006,1/1,null,13,null,135,Akira needs time to think
15776826,I'm with the Resistance,/users/actualbabe/pseuds/actualbabe,No Archive Warnings Apply,General Audiences,M/M,"Star Wars - All Media Types, Star Wars Sequel Trilogy",Poe Dameron/Finn,"Finn (Star Wars), Poe Dameron","Character Swap AU, first order pilot poe, resistance officer finn, Force Sensitive Finn, (finnpoe if you squint), One Shot",English,2018-08-23,Completed,2018-08-23,1001,1/1,null,24,2,109,"Finn's a big deal in the Resistance, but his mission to retrieve the map to Luke Skywalker has taken a turn for the worse. His time before the First Order tracks down BB-8 is ticking away, and he's building his escape plan as he goes. The only way he might possibly be able to make this work is if he can convince someone to help him. (An alternate meeting)"
15776814,Thinking too loud,/users/violetbear/pseuds/violetbear,No Archive Warnings Apply,Teen And Up Audiences,M/M,Mass Effect: Andromeda,"Jaal Ama Darav/Male Ryder | Scott, Jaal Ama Darav/Ryder","Jaal Ama Darav, Male Ryder | Scott",Fluff,English,2018-08-23,Completed,2018-08-23,410,1/1,null,15,1,143,Jaal's thoughts are keeping him awake.
15776808,hands,/users/micasdomain/pseuds/micasdomain,Creator Chose Not To Use Archive Warnings,Not Rated,M/M,Rooster Teeth/Achievement Hunter RPF,Gavin Free/Michael Jones,"Gavin Free, Michael Jones","Fake AH Crew, Body Worship",English,2018-08-23,Completed,2018-08-23,290,1/1,7,3,1,83,The muscles acting on the hand can be subdivided into two groups: the extrinsic and intrinsic muscle groups. The extrinsic muscle groups are the long flexors and extensors. They are called extrinsic because the muscle belly is located on the forearm. The intrinsic muscle groups are the thenar (thumb) and hypothenar (little finger) muscles; the interosseous muscles (four dorsally and three volarly) originating between the metacarpal bones; and the lumbrical muscles arising from the deep flexor (and are special because they have no bony origin) to insert on the dorsal extensor hood mechanism.
15776802,Served My Sentence,/users/CarleighAlpha/pseuds/CarleighAlpha,Creator Chose Not To Use Archive Warnings,Teen And Up Audiences,F/M,Supernatural,"Benny Lafitte/You, Benny Lafitte/reader","Benny Lafitte, Reader, Mention of Dean Winchester - Character",Purgatory,English,2018-08-23,Completed,2018-08-23,764,1/1,null,1,null,65,"{Y/N}, a hunter, gets trapped in Purgatory and is rescued by a handsome Vampire and the two make a deal to get out."
15776787,I Haven't Seen You In Forever,/users/CycloneRachel/pseuds/CycloneRachel,No Archive Warnings Apply,General Audiences,M/M,Supergirl (TV 2015),Querl Dox/Winn Schott Jr.,"Querl Dox, Winn Schott Jr.","Tumblr Prompt, Originally Posted on Tumblr, Fluff and Angst, Short One Shot, Friendship/Love, Reunions, Possibly Unrequited Love, Season 3 finale spoilers, in that it takes place sometime in season 4?, probably early on, title comes from a they might be giants song, I haven't posted anything with these two in forever, but I had this and figured I'd put it up",English,2018-08-23,Completed,2018-08-23,501,1/1,null,5,1,39,"Prompt from Tumblr user peskyshortcake: ""Brainy and Winn sending each other messages somehow while they're in different times."""
15776778,Armour Amour,/users/Disciplinary_Committee_Chief/pseuds/Disciplinary_Committee_Chief,No Archive Warnings Apply,General Audiences,,"Fire Emblem Series, Fire Emblem Heroes",,"Wendy | Gwendolyn, Dohga | Draug","Cute, Fluff",English,2018-08-23,Completed,2018-08-23,463,1/1,1,5,1,54,A cute little ficlet I wrote about Gwendolyn's fancy for Draug. I quite liked the Hone/Ward meta-jokes.
15776775,though i try to resist (i still want it all),/users/thunderpikes/pseuds/thunderpikes,No Archive Warnings Apply,Teen And Up Audiences,M/M,Voltron: Legendary Defender,Keith/Lance (Voltron),"Lance (Voltron), Keith (Voltron)","Pining Keith (Voltron), POV Keith (Voltron), Fluff, Fluff and Angst, Angst, Angst with a Happy Ending, kinda??, its really fluffy tho i swear its just keith being dumb, being in love with lance mcclain: a novel by keith kogane, Canon Compliant, i guess??, its set in season three",English,2018-08-23,Completed,2018-08-23,1402,1/1,2,49,5,462,"“What are you thinking of?”  Keith considered the question, “Everything and nothing and anything.”  He felt a fist gently push against his chest and felt his mouth curl up into a small smile before he could stop himself. “Stop being so cheesy.” He smiled into Lance’s hair, “Can’t help it, being your best friend has side effects.”"
15776763,How Phil finally got a Cat or Why Dan and Phil really moved out of their first London Apartment,/users/sky_fish/pseuds/sky_fish,Creator Chose Not To Use Archive Warnings,Teen And Up Audiences,M/M,Phandom/The Fantastic Foursome (YouTube RPF),Dan Howell/Phil Lester,"Dan Howell, Phil Lester, Louise Pentland","Domestic Fluff, Friendship, Romance, Humour, Established Relationship, a touch of fantasy, Mild Language, Mild Angst, Cats, slice-of-life",English,2018-08-23,Completed,2018-08-23,18738,1/1,6,22,3,276,"Dan said ""no"" to a cat already for a thousand times, but Phil still does not give up on the idea of getting a pet. The day after a severe fight over the  topic, Phil disappears and while Dan borders on another existential crisis, he finds an adorable black cat in their flat... "
15776754,Smitten in Ink,/users/NianaiBell/pseuds/NianaiBell,No Archive Warnings Apply,Not Rated,F/F,Voltron: Legendary Defender,Allura/Romelle (Voltron),"Allura (Voltron), Romelle (Voltron), Hunk (Voltron), Lance (Voltron), Keith (Voltron), Matt (kinda), Pidge | Katie Holt","Alternate Universe - Tattoo Parlor, TattooArtist!Allura, TattooArtist!Keith, Romelle is sunshine, Tattoos, Needles, inking, Hunk and Lance are supportive friends, Matt makes a cameo, Aged-Up Character(s), ticklish, tattooartist!Hunk",English,2018-08-23,Completed,2018-08-23,2138,1/1,4,23,1,190,"Day 11. Ticklish  Romelle decides it's time for a tattoo. Hunk recommends a friend at his shop. After seeing the the beauty of the artist, Romelle is smitten and unfortunately ticklish."
15776748,Puppy Love,/users/KittyFartingBubbles/pseuds/KittyFartingBubbles,No Archive Warnings Apply,General Audiences,M/M,GOT7,"Mark Tuan/Jackson Wang, Mark Tuan & Jackson Wang, Park Jinyoung | Jr. & Mark Tuan","Mark Tuan, Jackson Wang, Park Jinyoung | Jr.","Puppy Love, Tooth-Rotting Fluff, Cheesy, Parent Park Jinyoung, Slow Burn, It Literally Took Jackson 10 Years To Ask Mark To Date Him, Kid Mark Tuan, Kid Jackson Wang, Fluff, Self-Indulgent, Park Jinyoung Is So Done",English,2018-08-23,Completed,2018-08-23,1945,1/1,8,48,2,430,"The first time Mark sees Jackson, he has a red cape tied around his neck, a hand covering his eyes and he is running around like a lunatic and Mark, even with five years old, is worried. AKA Mark as a crush on Jackson and Jinyoung is not ready to let go of his precious baby son."
15776736,Late Change,/users/mew_tsubaki/pseuds/mew_tsubaki,No Archive Warnings Apply,Teen And Up Audiences,M/M,Haikyuu!!,Ennoshita Chikara/Tanaka Ryuunosuke,"Ennoshita Chikara, Tanaka Ryuunosuke, Narita Kazuhito, Kinoshita Hisashi","Angst, Kinonari in SPADESSSSS, bc i gotta deliver with my 2nd yr trio, Slow Burn, Slow Build, Biphobia, everyone does or says smthg wrong in this fic tbh lol",English,2018-08-23,Completed,2018-08-23,13475,1/1,null,12,null,93,"The only things Ennoshita took with him from high school are fond memories and his friendship with Narita and Kinoshita. Now, going into his final year of university, Ennoshita wants to treat himself for his hard work. The gods were listening, and they want to reward him. Quite. Handsomely."
15776733,I Want It All (With You),/users/hookedonmccutie/pseuds/hookedonmccutie,Creator Chose Not To Use Archive Warnings,General Audiences,,Once Upon a Time (TV),Captain Hook | Killian Jones/Emma Swan,,,English,2018-08-23,Completed,2018-08-23,957,1/1,1,19,2,185,Set about a year after Emma is freed of darkness. CS dancing and fluff at a wedding. Written after season 4 and before season 5.
15776730,We Were A Good Team,/users/svenzerosven/pseuds/svenzerosven,Creator Chose Not To Use Archive Warnings,Teen And Up Audiences,M/M,Voltron: Legendary Defender,Keith/Lance (Voltron),"Keith (Voltron), Lance (Voltron), Pidge | Katie Holt, Hunk (Voltron)","keith - Freeform, lance - Freeform, klangst, klance, sorry - Freeform",English,2018-08-23,Completed,2018-08-23,629,1/1,null,8,null,130,So this is another klangst fic... listen to any of these songs while reading (if yall want to tho) - they inspired me a little -  little do you know (alex&sierra): https://www.youtube.com/watch?v=L-lp2bejhm4 colors (halsey): https://www.youtube.com/watch?v=UvH5ZhSn1Jg who are you (5h): https://www.youtube.com/watch?v=hnhtI6IV9N0
15776712,Tend to Me Lover,/users/xxambreignsxx/pseuds/xxambreignsxx,No Archive Warnings Apply,Not Rated,M/M,"WWE, World Wrestling Entertainment, Professional Wrestling",Dean Ambrose | Jon Moxley/Roman Reigns,"Roman Reigns, Dean Ambrose | Jon Moxley","Established Relationship, Boys In Love and Lust, Fluff and Smut, Dirty Talk, Neediness, Cuddles, Humor, When Dean wants attention Roman WILL give him attention, That's the rule in the Roman/Dean household, Brat Dean, Adorable as fuck Dean, Amused Roman, Ambreigns all-round cuteness we all need in our lives to survive, Domestic",English,2018-08-23,Completed,2018-08-23,1588,1/1,12,37,4,465,Roman is too busy for Dean's liking and Dean is sick of being bored out of his mind. Time to make some demands.
