work_id,title,author,rating,category,fandom,relationship,character,additional tags,language,published,status,status date,words,chapters,comments,kudos,bookmarks,hits,summary
15542061,Bakugou Is The Jealous Type,/users/chinshimokkou/pseuds/chinshimokkou,Teen And Up Audiences,"F/M, M/M",Pu nohiroakademia | Boku no Hero Academia | My Hero Academia,"Bakugou Katsuki/Todoroki Shouto, Asui Tsuyu/Midoriya Izuku","Todoroki Shouto, Bakugou Katsuki, Midoriya Izuku, Kirishima Eijirou, Asui Tsuyu, Class 1-A (My Hero Academia)","Fluff, Cute Todoroki Shouto, Soft Bakugou Katsuki, Rip Deku, Overprotective Bakugou, Jealousy, Boys In Love, Boys Kissing",English,2018-08-03,Completed,2018-08-03,906,1/1,2,54,null,709,"This wasn’t the Bakugou Katsuki Todoroki knew. Sure, Bakugou always let down his walls when he was around Todoroki, but this, this was something else.—Todoroki almost kisses Midoriya, and Bakugou gets more than upset."
15542058,Paperwork,/users/RicochetRomance/pseuds/RicochetRomance,Mature,M/M,Star Wars - All Media Types,Obi-Wan Kenobi/Anakin Skywalker,"Anakin Skywalker, Obi-Wan Kenobi, Yoda (Star Wars), Jedi Council","Hurt/Comfort, Mild Angst, Weight Gain, Unhealthy Coping Mechanisms, Chubby Kink, chubby Obi-wan, Supportive Anakin, Happy Ending, obikin, Rated to be Safe",English,2018-08-02,Completed,2018-08-02,4530,1/1,6,30,null,509,"The Council makes a decision, Anakin risks his life, and Obi-Wan tries to cope. Standard operating procedure is rarely this emotional.  Please note that this is weight gain fanfiction - reader discretion is advised."
15542046,Come nelle favole,/users/DestielIsFuckinReal/pseuds/DestielIsFuckinReal,Not Rated,M/M,Supernatural,Castiel/Dean Winchester,"Castiel (Supernatural), Dean Winchester","Established Castiel/Dean Winchester, Inspired by Music, Fluff",English,2018-08-02,Completed,2018-08-02,352,1/1,null,3,null,39,
15542043,I'm Yours pt.2,/users/dchoe616/pseuds/dchoe616,Explicit,"F/M, Multi","DCU, DCU (Comics), DC Animated Universe, Red Hood and the Outlaws (Comics), Under the Red Hood, Red Hood - Fandom","Dick Grayson/Reader, Jason Todd/Reader, Dick Grayson/Jason Todd/Reader","Dick Grayson, Jason Todd, Red Hood, Nightwing, Reader, Female Reader - Character","Threesome - F/M/M, Anal Sex, Oral Sex, Sex, Rough Sex, Vaginal Sex, Handcuffs",English,2018-08-02,Completed,2018-08-02,7160,1/1,2,13,3,887,"Jason and Dick fight over who is better at sex, leaving you to decide."
15542028,Winter,/users/Hikaruaxi/pseuds/Hikaruaxi,Not Rated,F/F,BanG Dream! Girl's Band Party! (Video Game),Imai Lisa/Minato Yukina,"Imai Lisa, Minato Yukina","Fluff, I don't know what else to tag",English,2018-08-02,Completed,2018-08-02,708,1/1,5,25,null,179,Lisa is cold without Yukina with her.
15542022,Uncomfortable,/users/DistantShenanigans/pseuds/DarthLivion,General Audiences,F/M,Star Wars: The Clone Wars (2008) - All Media Types,CT-27-5555 | Fives | ARC-5555/Rabe,"CT-27-5555 | Fives | ARC-5555, Rabe (Star Wars)","Trans Male Character, Trans!Clones, Alternate Universe - Canon Divergence, Fluff, Gender Dysphoria, beach date",English,2018-08-02,Completed,2018-08-02,414,1/1,null,2,null,46,"Fives goes to the beach with his girlfriend for the first time, and feels some dysphoria. Rabé helps him through it."
15542004,On the Road,/users/tidal_race/pseuds/tidal_race,Not Rated,"F/M, Gen",Leverage,Aimee Martin/Eliot Spencer,"Aimee Martin, Eliot Spencer","Comment Fic, Don't Try This At Home",English,2018-08-02,Completed,2018-08-02,255,1/1,2,5,null,56,"Written for the prompt ""s/he has been awake so long that s/he doesn't know if it's today or tomorrow"" at Fic_Promptly"
15541998,Devil's Cleaning,,Explicit,M/M,Ni Zhuan Cai Pan  | Gyakuten Saiban | Ace Attorney,Garyuu Kirihito | Kristoph Gavin/Garyuu Kyouya | Klavier Gavin,"Garyuu Kirihito | Kristoph Gavin, Garyuu Kyouya | Klavier Gavin","Enemas, Grooming, Dubious Consent, Incest, Oral Sex, Anal Sex, Object Insertion, Abusive Relationship",English,2018-08-02,Completed,2018-08-02,3884,1/1,1,12,1,561,Kristoph has gotten all the preparation he needs to fuck Klavier in the ass.  Klavier is nervous.  Kristoph doesn't help.
15541986,hope is a four letter word,/users/kewltie/pseuds/kewltie,Teen And Up Audiences,M/M,Pu nohiroakademia | Boku no Hero Academia | My Hero Academia,Bakugou Katsuki/Midoriya Izuku,"Bakugou Katsuki, Midoriya Izuku, Kaminari Denki, Ashido Mina, Sero Hanta, Kirishima Eijirou","villain!deku, redemption story, Implied/Referenced Child Abuse, Manipulation",English,2018-08-02,Completed,2018-08-02,5562,1/1,5,139,12,1011,"Sitting before Denki on the floor of a dirty kitchen now is the infamous villain Yume, the Eater of Dreams; one of the League of Villains’ top lieutenants; Bakugou Katsuki’s long-lost childhood friend, Deku; and now Denki can also put a name to that face, Midoriya Izuku."
15541983,Patriotic Temper Tantrums,/users/3littlewords/pseuds/3littlewords,Teen And Up Audiences,F/F,Madam Secretary,Elizabeth McCord/Nadine Tolliver,"Elizabeth McCord, Nadine Tolliver, Blake Moran, Daisy Grant, Matt Mahoney, Jay Whitman, Russell Jackson",,English,2018-08-02,Completed,2018-08-02,1470,1/1,2,2,null,21,"4x01 AUA continuation from my other fic (‘When I am with you, I am home’).Starting with the verbal battle between Chiefs of Staff Nadine and Russell regarding Elizabeth’s ‘Patriotic Tantrums’ (which was awesome, come on now). Nadine wins girlfriend of the year, standing up for Elizabeth. Elizabeth tells Nadine something that has been on her mind. I wanted to explore vulnerability, the anxiety of the job, and the toll of false reporting not just on the political stage, but to the lives of the people on that stageElizabeth/Nadine Fluff!"
15541980,"Memories Hurt, Too",/users/TheWriterinFlannel/pseuds/TheWriterinFlannel,Teen And Up Audiences,M/M,"The Incredible Hulk (Comics), The Avengers (Marvel Movies), Marvel Cinematic Universe",Bruce Banner/Thor,"Bruce Banner, Thor (Marvel)","Emotional Comfort, Triggers, Child Abuse, Domestic Violence, Confessions, Childhood Trauma, manslaughter, Poor Bruce",English,2018-08-05,Completed,2018-08-05,1073,1/1,null,10,null,59,Bruce tells Thor about his childhood. Day 3 of ThorBruce Week 2018! The theme for today is Comfort.
15541971,keep it,/users/chingonas/pseuds/chingonas,General Audiences,M/M,Marvel Cinematic Universe,"Bruce Banner/Thor, Tony Stark & Bruce Banner, Tony Stark & Thor","Bruce Banner, Thor (Marvel), Tony Stark","Thorbruce Week, thorbruce week 2018, Height Differences, rommates, laundry mishaps, Fluff, domestic (sort of), Thurce Week, IM SO BAD AT TAGGING IM SORRY, uhhh, tony teases them",English,2018-08-02,Completed,2018-08-02,943,1/1,8,63,4,399,bruce takes thor's clothes because we all love wearing oversized clothes and anything thor wears is definitely oversized to bruce
15541965,Issues,/users/Karkalicious769/pseuds/Karkalicious769,General Audiences,Gen,Ben 10 Series,Rook Blonko & Ben Tennyson,"Rook Blonko, Ben Tennyson","Platonic Relationships, Friendship, Hurt/Comfort, Alcohol Abuse/Alcoholism, Emotional Baggage, Underage Drinking",English,2018-08-02,Completed,2018-08-02,5028,1/1,2,8,1,46,Rook and Ben have a long overdue talk.
15541959,Side,/users/Zon_Chan/pseuds/Zon_Chan,General Audiences,M/M,"Spider-Man - All Media Types, Deadpool - All Media Types",Peter Parker/Wade Wilson,"Peter Parker, Wade Wilson","Established Relationship, Fluff, Emotional Hurt/Comfort, Bad Days",English,2018-08-02,Completed,2018-08-02,189,1/1,2,39,4,570,"Wade is having a bad day, Peter helps his boyfriend."
15541947,eyes on you (not where they should be),/users/zundoko/pseuds/zundoko,Mature,M/M,"SixTONES (Band), Sexy Zone","mentioned fumaken, mentioned kento/others, Jesse Lewis/Nakajima Kento","Nakajima Kento, Jesse Lewis","Blowjobs, Coming Untouched, Coming In Pants, kento is a thot",English,2018-08-03,Completed,2018-08-03,509,1/1,null,null,null,23,"it was fuma's solo, so why was kento on his knees for a sixtones member?"
15541941,Off Duty,/users/theimaginesyouneveraskedfor/pseuds/theimaginesyouneveraskedfor,Mature,F/M,Marvel Cinematic Universe,Bucky Barnes/Reader,Bucky Barnes,"look sex happens in this, it was just an excuse to write smut, don't judge me because i already do that in the mirror, okay, i look back at myself and think, what a perv, but i can't change who i am",English,2018-08-02,Completed,2018-08-02,5173,1/1,8,43,3,714,The reader and Bucky are sent on a mission. Their prickly professional relationship might just need a more personal connection.
15541938,Aedificavimus amorem perenniorem aere,/users/Evil_Keshi/pseuds/Evil_Keshi,Mature,M/M,Shadowhunters (TV),Magnus Bane/Alec Lightwood,"Magnus Bane, Alec Lightwood, Asmodeus, Lorenzo Rey, Simon Lewis, Raphael Santiago, Ragnor Fell, Jace Wayland","Alternate Universe, Alternate Universe - Ancient Rome, Canon-Typical Violence, Romance, Angst, Getting Together, Mutual Pining, Angst with a Happy Ending",English,2018-08-02,Completed,2018-08-02,20034,1/1,30,103,22,1239,"Magnus and Alexander had always known that they could never have what they wanted: each other. In Rome, patricians didn't fall for slaves. Still, Magnus hoped that maybe... But hopes, in Rome, could die fast."
15541923,That time peter Came into the lab at a wrong time,/users/Awritinghufflepuff/pseuds/Awritinghufflepuff,Teen And Up Audiences,,"Marvel Cinematic Universe, The Avengers (Marvel Movies)",Hulk/Peter Parker,"Peter Parker, Bruce Banner, Hulk (Marvel), Tony Stark","Rape/Non-con Elements, Rape, Regret, Bruce Banner Hulks Out, Hulk Sex (Marvel)",English,2018-08-02,Completed,2018-08-02,1009,1/1,3,6,null,450,"I shouldnt have posted this... I really should not have posted nor written this.Bruce hulks out in the lab and it turns out hulk is horny. Peter is the first person hulk can get his hands on, unfortunately..."
15541917,What I Do For You,/users/Esperata/pseuds/Esperata,Mature,M/M,"Marvel Cinematic Universe, The Avengers (Marvel Movies)",Bruce Banner/Thor,"Bruce Banner, Thor (Marvel)","Closet Sex, almost, Fluff, Cuddling",English,2018-08-02,Completed,2018-08-02,620,1/1,13,67,2,405,"Bruce had been reading a magazine, shown an interesting article to his boyfriend and now found himself facing a logistical challenge. For the Thorbruce week prompt: Height Difference"
15541905,Property,/users/mushroomnoodles/pseuds/xthefragile,Explicit,M/M,"Nine Inch Nails (Band), Marilyn Manson (Band)",Marilyn Manson/Trent Reznor,"Marilyn Manson, Trent Reznor","Self-Harm, Blood Kink, Bloodplay, Choking, Breathplay, Plot What Plot/Porn Without Plot",English,2018-08-02,Completed,2018-08-02,709,1/1,2,4,null,62,Bloodplay and breathplay Manznor smut for y'all
15541893,Blue M&M's,/users/an0neemouse/pseuds/an0neemouse,General Audiences,M/M,Super Junior,Cho Kyuhyun/Kim Ryeowook,"Cho Kyuhyun, Kim Ryeowook","Friendship, Drabble, Cute, Fluff, based off real life cuteness, Friend Love, M&M's",English,2018-08-02,Completed,2018-08-02,183,1/1,2,4,1,65,Kyuhyun can be sweet sometimes.
15541884,Lying can make everything worse,/users/Amvfever/pseuds/Amvfever,Not Rated,,Assassination Classroom,"Akabane Karma/Shiota Nagisa, Isogai Yuuma/Kataoka Megu, Horibe Itona/Terasaka Ryouma","Shiota Nagisa, Akabane Karma, Akabane Karma's Mother, Korosensei (Assassination Classroom), Bitch sensei, Isogai Yuuma, Kataoka Megu, Yada Touka, Nakamura Rio, Kurahashi Hinano, Karasuma Tadaomi, Kayano Kaede, Maehara Hiroto, Sugino Tomohito, Okuda Manami, Terasaka Ryouma, Class 3-E, Class 3-A (Assassination Classroom), E Class teachers, Irina Jelavic, Horibe Itona","Main campus, Sickfic, Sick nagisa, Spiders, Snakes, Bees, Coughing, Vomiting, Assassination, Worry, friends - Freeform, being there for each other, class, Class 3 E (Assassination Classroom), Assassin - Freeform, Hurt/Comfort, Fainting, School, Konogikaoka middle school, Swimming, lying, Hospitals, Jealousy, Class-A being assholes as always, Screaming, Crying, kinda funny, Funny, Comedy, Sad, Sad and Happy, Gastrointestinal, Assassin Shiota Nagisa, Assassin Karma, Karma is worrying",English,2018-08-02,Completed,2018-08-02,3056,1/1,null,16,3,379,The class 3-E made their way to the main campus. It was a horrible way but it's worse than everyone thought. Nagisa doesn't like to let everyone know that he didn't feel good and he lied that he's alright.
15541887,The Puppy Picture Didn't Deserve that Fate,/users/Kingalexdreaming/pseuds/Kingalexdreaming,General Audiences,M/M,Detroit: Become Human (Video Game),"Jerry(s)/Ralph (Detroit: Become Human), Kara & Luther & Alice Williams (Detroit: Become Human), Jerry(s) & Ralph (Detroit: Become Human)","Ralph (Detroit: Become Human), Jerry(s) (Detroit: Become Human), Kara (Detroit: Become Human), Luther (Detroit: Become Human), Alice Williams (Detroit: Become Human)","Non-Sexual Age Play, Age Regression/De-Aging, But Only a Little Bit - Freeform, More later - Freeform, That's right, This may be a series, This is probably bad, oh well, no beta we die like men, Short, Coloring, Crayons, I use the words crayon and coloring way too many times in this, I'm Sorry, Tantrum, almost a tantrum, I'm nervous to post this tbh, It's real short, really short, Drabble",English,2018-08-02,Completed,2018-08-02,516,1/1,13,43,4,297,I'll add a better title later. Leave me alone.
15541869,"Welcome Home, Baby Papa!",/users/KaliopeShipsIt/pseuds/KaliopeShipsIt,General Audiences,M/M,Teen Wolf (TV),Derek Hale/Stiles Stilinski,,"Mpreg, Pregnant Stiles, Alpha/Beta/Omega Dynamics, Alpha Derek Hale, Omega Stiles Stilinski, Established Relationship, Kid Fic, Family Feels, Family Fluff, Soldier Derek Hale, Civilian Stiles Stilinski, Unplanned Pregnancy, Alternate Universe - Army, Trigger warning:, mention of PTSD, mention of past injury, deployments",English,2018-08-02,Completed,2018-08-02,6420,1/1,25,402,54,4075,"Ten days after Army soldier and family father Derek has left for his latest deployment, his mate Stiles gets some thoroughly unexpected news. Six months later, the Alpha returns to a very big surprise."
15541857,Time Alone,/users/SundialSith/pseuds/SundialSith,Not Rated,F/F,Steven Universe (Cartoon),Pearl/Rose Quartz (Steven Universe),"Rose Quartz | Pink Diamond, Pearl (Steven Universe), Yellow Diamond (Steven Universe), Blue Diamond (Steven Universe), White Diamond (Steven Universe), Greg Universe","Emotional Hurt/Comfort, Inner Dialogue, Day Dreaming, sort of, Pre-Canon, Rose Quartz is Pink Diamond Theory, Implied Rose Quartz/Greg Universe, Started as a drabble, Got carried away lol",English,2018-08-02,Completed,2018-08-02,1650,1/1,4,47,6,467,Rose feels overwhelmed and decides to take a break with things in her room - including her identity.
15541839,taking care,/users/assassin_trifecta/pseuds/assassin_trifecta,Teen And Up Audiences,M/M,The Flash (TV 2014),"Cisco Ramon/Earth-2 Harrison ""Harry"" Wells","Cisco Ramon, Earth-2 Harrison ""Harry"" Wells","soft dom!Cisco, Tired Harry, briefly mentioned s4 fix-it, Comfort fic, Mention of sex, No actual sex, just dom Cisco taking care of his boyfriend, harriscofest 2018, Prompt Fill",English,2018-08-02,Completed,2018-08-02,1398,1/1,4,9,null,105,Cisco’s weekend visits take an unknown and unexpected toll on Harry. Cisco does everything he can to ease the burden.
15541824,"who's your daddy, what's his name, how much money does the old man make?",/users/narcissae/pseuds/narcissae,Teen And Up Audiences,M/M,"Marvel Cinematic Universe, Deadpool - All Media Types, Iron Man (Movies), Deadpool (Movieverse)",Peter Parker/Wade Wilson,"Tony Stark, Wade Wilson, Peter Parker","Tony Stark Has A Heart, BAMF Tony Stark, Shovel Talk, Parent Tony Stark, Implied Past Rape",English,2018-08-02,Completed,2018-08-02,1099,1/1,13,187,16,1432,"Wade really wanted to have a peaceful night. He did not expect to get accosted by Tony Stark's Iron Legion, and he certainly didn't expect to get a shovel talk that sounded more like a supervillain origin monologue.  Meanwhile, Tony really just wants to be a good mentor-slash-father figure to Peter, and look out for his disaster gay spider son's safety."
15541821,Take me out for a night on the town,/users/SweetbunThorn/pseuds/SweetbunThorn,Teen And Up Audiences,M/M,Persona 5,Sakamoto Ryuji/Original Male Character(s),"Sakamoto Ryuji, Original Male Character(s)",Ryuji going on a date,English,2018-08-02,Completed,2018-08-02,1180,1/1,null,7,null,56,"Ryuji cursed his brain for not thinking straight. “I mean, d-do you wanna go on a date with me?”"
15541818,Scientific Method,/users/Kumakins/pseuds/Kumakins,Teen And Up Audiences,M/M,"Rockman | Mega Man - All Media Types, Rockman X | Mega Man X","Friendship - Relationship, More than Friendship?","X (Rockman), Gamma (Rockman), Storm Eagleed | Storm Eagle, Gravity Beetbood | Gravity Beetle","VAVA | Vile (Rockman) mentioned, Sigma (Rockman) mentioned, Social Experiments, Discussions of Love and Sexuality, Yes. THAT Gamma from THAT Gamma Unit., LabTech X",English,2018-08-02,Completed,2018-08-02,3305,1/1,9,10,null,74,"“What brings you here?” X asked, teetering back on his heels to look up at the Elite, A-Class Hunter. Gamma’s expression firmed. He paused long enough to ensure he held the reploid template's full attention. His brows knit resolutely as he laid out a bold proposition: “Let's fall in love.""---Originally posted as a chapter in the Doctor Cain Era story, but it was too long."
15541815,"none has understood you, but i understand you",/users/thymelord/pseuds/thymelord,Explicit,M/M,"Doctor Who (2005), Doctor Who, Doctor Who & Related Fandoms","Tenth Doctor/The Master (Simm), The Doctor/The Master","Tenth Doctor, The Master (Simm), The Master (Doctor Who), Martha Jones","Episode: s03e12 The Sound of Drums, Mildly Dubious Consent, nonconsensual voyeurism, Bloodplay, Restraints, Bondage, BDSM, Rough Sex, Blowjobs, Anal Sex, Confessions, Realisations, It's a bit fucked up, Not quite Dead Dove territory though, Not Actually Unrequited Love, Mutual Pining, (for centuries), Enemies With Benefits, Enemies to Lovers, pretty sure the Master is secretly a vampire, Infidelity",English,2018-08-02,Completed,2018-08-02,2133,1/1,2,9,1,163,"The Doctor never could resist him.  Not even now, imprisoned on the Valiant with a hundred reasons to hate him."
15541812,21 Questions,/users/xkarasdanversx/pseuds/x,Mature,F/F,"supercorp - Fandom, Supergirl",Kara Danvers/Lena Luthor,"Kara Danvers, Lena Luthor","Smut, Friends to Lovers, Movie Night, Really Just Pure Filth, SuperCorp, karlena",English,2018-08-02,Completed,2018-08-02,1244,1/1,3,133,3,3486,"I’ve never actually played that” Kara said suddenly, . “ 21 questions? “ Lena asked with a little bit of surprise in her voice. Usually it was her who had never played a game or missed some basic childhood experience. “ Nope, sounds fun though” Kara said. “ Well do you have a bottle of tequila? We could play it now if you want?” Or, Kara and Lena give a new meaning to movie night."
15541800,Be there,/users/Zon_Chan/pseuds/Zon_Chan,General Audiences,M/M,"Iron Man (Movies), Black Panther (2018), The Avengers (Marvel Movies)",Tony Stark/T'Challa,"Tony Stark, T'Challa (Marvel)","Post-Captain America: Civil War (Movie), Hurt/Comfort, Emotional Hurt/Comfort, Established Relationship",English,2018-08-02,Completed,2018-08-02,279,1/1,null,41,5,723,T'Challa helps Tony get through a panic attack.
15541794,The Moons Make Witness,/users/ShyChangling/pseuds/ShyChangling,Teen And Up Audiences,"Gen, Other",Red vs. Blue,,"Locus | Samuel Ortez, Felix | Isaac Gates","CL AU, Character Death, Temporary Death, and, permanent death, Alternate Universe - Fantasy",English,2018-08-02,Completed,2018-08-02,618,1/1,2,2,null,16,"The bounty did not mention Roses. The Moons over head see them fight. But she and they can do nothing. Simply bare witness to the trap the Roses had set. For Locus to fall, but perhaps there is something to be done."
15541791,[Podfic] The Less You Know,/users/Hananobira/pseuds/Hananobira,General Audiences,Gen,"Spider-Man: Homecoming (2017), Marvel Cinematic Universe, The Avengers (Marvel Movies)",,"Peter Parker, Steve Rogers, Ned Leeds, Michelle Jones, Tony Stark, Happy Hogan","Podfic & Podficced Works, Podfic, Audio Format: MP3, Audio Format: M4B, Fluff and Humor",English,2018-08-02,Completed,2018-08-02,40,1/1,1,15,null,378,Peter comes to regret telling the Avengers about the Captain America PSAs.
15541776,She was the girl across the room.,/users/Frnk/pseuds/Frnk,Not Rated,F/M,My Chemical Romance,Frank Iero/Gerard Way,"Frank Iero, Gerard Way, Mikey Way, Linda Iero, Donna Way","Trans Male Character, Trans Female Character, FTM Frank Iero, MTF Gerard Way, Falling In Love, First Meetings, Awkward Flirting, Love Confessions, Fluff, Fluff and Smut, Anal Fingering, Vaginal Fingering, Vaginal Sex, Growing Up, Time Skips, First Time, Dating, Frank Iero is a Sweetheart, Pet Names, Awkward Frank Iero, Body Dysphoria",English,2018-08-02,Completed,2018-08-02,7142,1/1,2,29,1,222,"Frank met snorting girls eyes and grinned as she stuck out her tongue, crossing her eyes. Frank did it straight back. ""Gee. Frank, please. This is helpful for everyone else."""
15541773,Waves crashing against the shore,/users/yugkookisreal/pseuds/yugkookisreal,Not Rated,M/M,"bangtansonyeondan | Bangtan Boys | BTS, Monsta X (Band)",Min Yoongi | Suga/Yoo Kihyun,"Min Yoongi | Suga, Yoo Kihyun","Seaside, Childhood Friends, Yoo Kihyun-centric, Min Yoongi | Suga Is Bad at Feelings, Friendship/Love, I Wrote This Instead of Sleeping, I Ship It, I Will Go Down With This Ship, Crack Treated Seriously, Cute, Angst with a Happy Ending, I'm Bad At Tagging, Soft Min Yoongi | Suga, Producer Min Yoongi | Suga, Gentle Kissing, Boys Kissing, Surprise Kissing",English,2018-08-02,Completed,2018-08-02,2278,1/1,null,4,null,71,"✩ they left each other before they could understand what they were feeling. but after years later yoongi's back and kihyun wants to hate him. instead he wants him to answer all of his questions, ease his mind a little bit before life in the village kills him.   [lower case intended]"
15541767,It's a terrible love and I'm walking with spiders,/users/merrythoughts/pseuds/merrythoughts,Explicit,M/M,Teen Wolf (TV),Chris Argent/Peter Hale,,"Dysfunctional Relationships, Trauma, Angst, POV Second Person, Idiots in Love, Blood Kink, Rough Sex",English,2018-08-02,Completed,2018-08-02,1977,1/1,2,9,2,133,"It's always felt this way, like he's stealing from you, forcing you... Muscles sore, wounds aching, but your mind is quiet."
15541764,Just Friends,/users/Marrilyn/pseuds/Marrilyn,General Audiences,Other,Supernatural,Rowena MacLeod & Original Female Character(s),"Rowena MacLeod, Original Female Character(s)","Unrequited Love, Friendship, Friendship/Love",English,2018-08-02,Completed,2018-08-02,1635,1/1,null,7,null,42,Rowena develops not-so-friendly feelings for her new friend.
15541755,Nothing She Can't Handle,/users/DestinyFreeReally/pseuds/DestinyFreeReally,General Audiences,F/M,The Punisher (TV 2017),Frank Castle/Karen Page,"Frank Castle, Karen Page",Part Two,English,2018-08-02,Completed,2018-08-02,470,1/1,null,19,null,287,"Part Two to GSW. Karen's shot, Frank's the Punisher. A classic tale."
15541749,"you are not alone, i've been here the whole time singing you a song",/users/racheltuckerrr/pseuds/racheltuckerrr,General Audiences,F/F,Ocean's 8 (2018),Lou Miller/Debbie Ocean,"Debbie Ocean, Lou Miller (Ocean's), Tammy (Ocean's), Amita (Ocean's), Constance (Ocean's), Rose Weil, Daphne Kluger, Nine Ball (Ocean's)","Heist Wives, Hurt/Comfort, Post-Heist, Sick Fic, also a bit of lou!backstory but not too much, they are ridiculous and they know it and so does everyone else",English,2018-08-02,Completed,2018-08-02,4521,1/1,13,88,9,807,"When Lou falls ill soon after the Met heist, Deb becomes slightly overprotective as she takes care of her and here's how that goes."
15541737,Two couple tributes with music,/users/Captain29thegamer/pseuds/Captain29thegamer,Not Rated,F/M,Miraculous Ladybug,"Chat Noir/Ladybug (Miraculous Ladybug), Plagg/Tikki (Miraculous Ladybug)","Chat Noir (Miraculous Ladybug), Ladybug (Miraculous Ladybug), Plagg (Miraculous Ladybug), Tikki (Miraculous Ladybug)","Shipping, music tribute, Inspired by Miraculous Ladybug",English,2018-08-02,Completed,2018-08-02,531,1/1,null,null,null,87,"I am obsessed with plagg, he’s so adorable"
15541725,When the Saints Go Marching In - klaroline*,/users/xStronger/pseuds/xStronger,General Audiences,"F/F, F/M","The Originals (TV), The Vampire Diaries (TV), The Vampire Diaries & Related Fandoms","Caroline Forbes/Klaus Mikaelson, Caroline Forbes & Hope Mikaelson","Caroline Forbes, Klaus Mikaelson, Elijah Mikaelson, Freya Mikaelson, Rebekah Mikaelson, Kol Mikaelson, Hayley Marshall, Keelin Malraux, Davina Claire, Elena Gilbert, Matt Donovan, Stefan Salvatore, Bonnie Bennett, Damon Salvatore, Hope Mikaelson, Josie Saltzman, Lizzie Saltzman","Fix-It, Character Death Fix, Emotional, Emotional Hurt, Klaroline, Vampire Caroline Forbes, BAMF Caroline Forbes, Bittersweet Ending, Alternate Ending, Canonical Character Death, Past Relationship(s), Werewolves, Fluff and Angst, Family Feels, Family Fluff",English,2018-08-02,Completed,2018-08-02,1266,1/1,14,71,4,1202,"“He’s your first love - I intend to be your last. However long it takes.” - “I don’t know how to say goodbye.” “Try this, one of you stands, walks to the door, but doesn’t turn back. Even if their heart aches for just one more look, one more moment; but you’ll know that the not looking just means, I’ll never forget you.” *The Originals fix it fic; or ""how The Originals should have ended"" fic"
