work_id,title,author,rating,category,fandom,relationship,character,additional tags,language,published,status,status date,words,chapters,comments,kudos,bookmarks,hits,summary
15534654,"i'll give you a daisy a day, dear.",/users/hvedrungr/pseuds/hvedrungr,General Audiences,M/M,"Marvel Cinematic Universe, Thor (Movies)",En Dwi Gast | Grandmaster/Loki,"En Dwi Gast | Grandmaster, Loki (Marvel), Thor (Marvel) - Mentioned","Angst, Grief, Loss of loved ones, yeah this ain't happy, anyway so listen, i know that en dwi can do literally anything, but all i'm saying is, what if something happened, and it just didn't work, this is mostly just self-indulgent bc I Love Pain, also i threw it together at three o'clock and wasn't bothered with proof reading, good fuckin luck lmao, anyway i hope u cry, oh yeah i should mention, Canon Divergent, Post Infinity War, non infinity war compliant, if that even makes sense, suffer, all in lowecase bc a) aesthetic b) i'm fucking lazy lmao",English,2018-08-02,Completed,2018-08-02,727,1/1,1,29,1,180,"
en dwi gast has a habit of wanting what he can’t have, wanting what will never stay.
"
15534621,I Hate You,/users/Skeletonbrothersreptilelovers/pseuds/Skeletonbrothersreptilelovers,General Audiences,F/M,Undertale (Video Game),Papyrus (Underdswap)/Reader,"Papyrus, Sans","Regrets, Never again, Not what you think, fun times, underswap - Freeform, Alternate Universe - Underswap",English,2018-08-02,Completed,2018-08-02,811,1/1,15,29,1,231,You can't believe Papyrus did this. He regrets it too. Both of you hate him.
15534606,The science of madness,/users/dahtwitchi/pseuds/dahtwitchi,Teen And Up Audiences,M/M,Naruto,Senju Tobirama/Uchiha Madara,"Uchiha Madara, Senju Tobirama","MadaTobi Week 2018, prompt Mad Scientist, Madness, Art, Comic, Body Horror, But without blood or too much visualisation, Captivity, held captive, Human Experimentation, Mad scientist dungeon, Less than canon gore, Far less actually, Mad Scientists",English,2018-08-02,Completed,2018-08-02,0,1/1,4,37,3,420,But who is the mad one?
15534597,Traitor,/users/CryloRen_IsAtItAgain/pseuds/CryloRen_IsAtItAgain,Explicit,M/M,Star Wars Sequel Trilogy,Armitage Hux/Ben Solo | Kylo Ren,"Ben Solo | Kylo Ren, Armitage Hux, Leia Organa (mentioned)","face fucking, No Lube, Rape, Hux is Not Nice, Redeemed Ben Solo, Rough Sex, Rough Oral Sex, Blood, bloody nose, Acceptance, Major character death - Freeform",English,2018-08-02,Completed,2018-08-02,2445,1/1,null,12,1,208,Ben Solo is a traitor to the First Order. Hux shows him what happens to those who betray him.
15534594,Have your cake and then eat me,/users/Queenofthebees/pseuds/Queenofthebees,Explicit,F/M,"A Song of Ice and Fire - George R. R. Martin, A Song of Ice and Fire & Related Fandoms, Game of Thrones (TV)",Jon Snow/Sansa Stark,"Jon Snow, Sansa Stark","Alternate Universe - Modern Setting, heels kink, Cunnilingus, Sexual Content, Woman on Top, Face-Sitting",English,2018-08-02,Completed,2018-08-02,1308,1/1,8,57,3,1137,"""Wait!"" he called suddenly as she reached for the drawer to get a condom. She raised her eyebrows, sitting back a little. Jon licked his lips, his Adams apple bobbing with a nervous swallow. ""Do, uh...do I still get to do what I want to you?"" ""That was the deal,"" she replied, tilting her head in curiosity. Jon grinned, his hands falling to her hips as he gently guided her up his body. Her cheeks flushed as she realised what he intended. ""Jon..."" ""You don't have to,"" he said quickly, looking up at her softly. ""I just...I really love the idea of you sitting on my face!"" Missing scene from chapter 7 of I Won't Let You Be Denied. Day 4 of Jonsa Smut week: Hungry for you"
15534588,[(allYue )] Dong Wu Kuang Huan Ye (Wan Jie ),/users/yutaoguan/pseuds/yutaoguan,Teen And Up Audiences,F/F,4p. ,Bu Yang Ling Yue ,Hei Bao Yang xHui Lang Fan xXiao Mao Chao xXi Xie Gui Yue ,,English,2018-08-02,Completed,2018-08-02,197,1/1,null,24,null,2373,
15534582,Just Like Old Times,/users/TheFourtiethHorseman/pseuds/TheFourtiethHorseman,General Audiences,Gen,"Batman (Comics), Nightwing (Comics)",,"Dick Grayson, Bruce Wayne, Tim Drake, Alfred Pennyworth, Barbara Gordon","Corporal Punishment, Non-Consensual Spanking, Punishment of an adult, Tim Drake is Robin, Dick Grayson is Nightwing, Father-Son Relationship, Dysfunctional Family",English,2018-08-02,Completed,2018-08-02,2024,1/1,3,27,2,384,"""It felt almost… not quite comforting, but at least familiar.  He’d never liked it as a kid (of course he didn’t), but he’d understood why he’d deserved it.  Get punished, get forgiven, and everything was fine again."""
15534579,Welcome To The World,/users/Hazurfurn/pseuds/Hazurfurn,General Audiences,F/F,Steven Universe (Cartoon),Original Gem Character(s)/Original Female Character(s),"Original Gem Character(s), Original Character","Domestic Fluff, Pregnancy, Children, Implied Sexual Content, non-explicit childbitrh, no one dies here, Chiastolite, She is an old tired soul, Old habits don't die hard",English,2018-08-02,Completed,2018-08-02,2858,1/1,null,4,null,62,"After the Rebellion a former Homeworld soldier has an impromptu retirement on Earth, she was getting tired of fighting and the last battles diminished her will to fight. She decided to make a new life for herself and avoid conflict, learn human cultures.  Nearly six thousand years later said gem did not expect to meet, go through thick and thin, fall in love and marry said human. Two years into their marriage said human proposed the insane experimental idea of starting a family with a gem. She hesitantly agreed. And the results were emotionally beautiful."
15534576,We belong,/users/GreenPhoenix/pseuds/GreenPhoenix,Mature,M/M,Hannibal (TV),Will Graham/Hannibal Lecter,"Will Graham, Hannibal Lecter",,English,2018-08-02,Completed,2018-08-02,464,1/1,2,26,1,null,Post-Fall Hannibal has a hard time forgiving Will.
15534561,Moment of Truth,/users/Ithiel_Dragon/pseuds/Ithiel_Dragon,Teen And Up Audiences,M/M,Detroit: Become Human (Video Game),Hank Anderson/Connor,"Hank Anderson, Connor (Detroit: Become Human)","Alternate Universe - Canon Divergence, Alternate Ending, Spoilers, Angst",English,2018-08-02,Completed,2018-08-02,1273,1/1,17,147,17,837,"“Moment of truth, Connor...  What are you gonna do?”"
15534543,home,/users/mesoquatic/pseuds/mesoquatic,Not Rated,,Detroit: Become Human (Video Game),,Markus (Detroit: Become Human),"Pacifist Best Ending (Detroit: Become Human), Pacifist Markus (Detroit: Become Human), carl is dead, Post-Canon, Leo is alive, Drabble",English,2018-08-02,Completed,2018-08-02,537,1/1,null,1,null,22,"Without the special touch, it really wasn't home anymore. It was just a husk of its former self."
15534534,Reunited,/users/Symone_Nicole/pseuds/Symone_Nicole,Not Rated,M/M,"Star Wars Episode VII: The Force Awakens, Star Wars","Finn/Kylo Ren, Finn/Ben Solo | Kylo Ren","Finn, Kylo Ren","not rated - Freeform, dating websites, dating profile generator, Soulmate AU, Force Sensitive Finn, I suck at tagging, i suck at summaries",English,2018-08-02,Completed,2018-08-02,1815,1/1,2,15,1,84,"Finn comes across Kylo Ren on a dating website, but it's not like he was trying to be discrete."
15534528,Midnight Love Duel,/users/Rashaan_Butler/pseuds/Rashaan_Butler,Teen And Up Audiences,F/F,Real Bout High School,Mitsurugi Ryoko/Kiribayashi Azumi,"Mitsurugi Ryoko, Kiribayashi Azumi","Teen Romance, Lesbian, Martial Arts, Implied Sexual Content",English,2018-08-02,Completed,2018-08-02,2081,1/1,null,null,null,3,Samurai Girl: Real Bout High School manga - takes place during Vol.03.  A midnight duel at the Kiribayashi estate leads to the start of something wonderful between two lovely young female martial artists. Oneshot.  Shoujoai RyokoxAzumi.
15534525,Knowing What Happened,/users/TSPrincxietyTrash/pseuds/TSPrincxietyTrash,General Audiences,M/M,Sanders Sides (Web Series),"Logic | Logan Sanders/Morality | Patton Sanders, background pre-romantic prinxiety","Logic | Logan Sanders, Morality | Patton Sanders, Creativity | Roman ""Princey"" Sanders, Anxiety | Virgil Sanders","Human AU, College AU, Drinking, Flirting, Kissing, Fluff, that's it really it's just cute fluff",English,2018-08-02,Completed,2018-08-02,5019,1/1,2,34,null,200,"Logan has spent his whole life on the sidelines, watching while others had their first kisses, their first relationships, all through highschool and his first year at college he had never met anyone who he was interested in romantically or who was romantically interested in him.  Imagine his surprise (and frankly disdain) at being dragged to a house party by Roman only to fall head first into a ridiculous, over the top, dramatic crush on Roman’s childhood best friend Patton. Surely no good can come of this…"
15534510,In the Hands of a Murderer,/users/SamGayWinchester/pseuds/SamGayWinchester,Not Rated,M/M,Supernatural,Castiel/Dean Winchester,"Sam Winchester, Dean Winchester, Castiel (Supernatural)","Destiel - Freeform, serial killer au, Serial Killer Dean Winchester, Human Castiel",English,2018-08-02,Completed,2018-08-02,764,1/1,null,4,null,164,"Sam, Dean, and Castiel go out camping.But not Dean can't control himself"
15534498,Big and Bold,/users/sweetIies/pseuds/sweetIies,Explicit,M/M,NCT (Band),Mark Lee/Wong Yuk Hei | Lucas,"Mark Lee (NCT), Wong Yuk Hei | Lucas","Smut, Porn with Feelings, and a little plot, But Mostly Smut, Omegaverse, Alpha/Beta/Omega Dynamics, Alpha!Yukhei, Omega!Mark, Dom/sub Undertones, Trans Male Character, Making Out, Degradation, Dirty Talk, Knotting, Breeding, Some Fluff, Knife Play, Brief Mention of Blood",English,2018-08-02,Completed,2018-08-02,3312,1/1,10,99,8,1757,"But, as his Omega drew closer, the older one couldn’t seem to act against his instincts anymore, and their eyes met.Red met gold, fear and anticipation met coldness and dominance.A visible shiver went through the Alpha's body and Mark drew even closer, his face merely inches away from Yukhei's, his breath hot and rigid on the others lips."
15534495,Punch-Drunk and Available,/users/mia6363/pseuds/mia6363,Teen And Up Audiences,F/M,Teen Wolf (TV),Bobby Finstock/Kira Yukimura,"Kira Yukimura, Bobby Finstock, Peter Hale, Stiles Stilinski","First Meetings, Meet-Cute, Alternate Universe, Hospitalization, Flirting, Flirting In Hospital Beds, awkward first meetings, Awkward Kissing, Accidental Physical Assault, Peter's going to laugh about this for the rest of his life",English,2018-08-02,Completed,2018-08-02,2565,1/1,22,46,2,159,"“How,” Peter Hale, professional doctor at Kindred Hospital, giggled as he crossed his arms, taking a good look at his best friend and the man she’d pepper sprayed. “How did this happen?”"
15534486,When You Come Home,/users/RWBYGuy2015/pseuds/RWBYGuy2015,General Audiences,F/F,RWBY,Ruby Rose/Weiss Schnee,"Ruby Rose (RWBY), Weiss Schnee","Angst, Emotional Hurt/Comfort, Emotional Hurt",English,2018-08-02,Completed,2018-08-02,353,1/1,4,30,null,451,Weiss couldn't help but smile when she thought about Ruby.
15534474,Adventures in the great outdoors,/users/aimless38/pseuds/aimless38,General Audiences,"Gen, M/M",Fullmetal Alchemist: Brotherhood & Manga,Edward Elric/Roy Mustang,"Edward Elric, Roy Mustang, Alphonse Elric","Light Angst, Fluff, Hurt/Comfort",English,2018-08-02,Completed,2018-08-02,4697,1/1,null,16,5,181,"Ed, Roy, and Al take a much-needed vacation. Trouble ensues."
15534471,Dreams do Come True,/users/katastrophix/pseuds/katastrophix,Teen And Up Audiences,F/F,Mamamoo,Jung Wheein/Kim Yongsun | Solar,"Jung Wheein, Kim Yongsun | Solar, Moon Byulyi | Moonbyul, Ahn Hyejin | Hwasa",Dreams,English,2018-08-02,Completed,2018-08-02,1716,1/1,null,4,null,55,"What would happen if you met the woman of your dreams in real life? What if you talked to her, but they weren't the person you thought they were?"
15534456,Angel Wings Arcade,/users/Angel_Castiel/pseuds/Angel_Castiel,Teen And Up Audiences,,Supernatural,"Castiel/Dean Winchester, Castiel & Dean Winchester","Dean Winchester, Castiel (Supernatural), Gabriel (Supernatural), Sam Winchester, Anna Milton (mentioned), Samandriel (Supernatural) (mentioned)","Alternate Universe - High School, Arcades, Cute, Pining Castiel, Pining Dean Winchester, Young Sam Winchester, Arcade Owner Gabriel (Supernatural), Castiel and Gabriel (Supernatural) are Siblings, Human Castiel, Teen Castiel (Supernatural), Teen Dean Winchester, Fluffy Ending, Fluff and Angst, Funny Gabriel (Supernatural), Protective Gabriel (Supernatural), Gabriel Being Gabriel",English,2018-08-02,Completed,2018-08-02,4504,1/1,4,85,8,569,"Castiel works in his older brother, Gabriel's, arcade on weekends and after school. Cas mans the prize counter two school nights a week and every Sunday all day. Dean is just a regular customer at the arcade with his younger brother Sam. He usually let's Sam spend the tickets, but this time... this time he wants something.  After all, everything behind the counter can be purchased with tickets, right?"
15534453,a game of cat and mouse,/users/Emeraldxoxo/pseuds/jadedgalaxies,Mature,M/M,"Dangan Ronpa - All Media Types, New Dangan Ronpa V3: Everyone's New Semester of Killing","Oma Kokichi/Saihara Shuichi, mentioned Naegiri","Oma Kokichi, Saihara Shuichi, Kirigiri Kyouko","No Despair AU, Implied/Referenced Sex, Organized Crime, Detectives, DICE is closer to Kokichi's organization of 10000, Handcuffs, Flirting, Ambiguous/Open Ending",English,2018-08-02,Completed,2018-08-02,2297,1/1,12,78,6,476,"AU. As Shuichi gets closer to uncovering the identity of D.I.C.E.'s leader and bringing the organization down, he is ambushed by a member of D.I.C.E.... A member that just so happens to be the Ultimate Supreme Leader."
15534432,"Don't Do It, Gavin",/users/RedWritingHood/pseuds/RedWritingHood,Teen And Up Audiences,Gen,Detroit: Become Human (Video Game),"Gavin Reed & Elijah Kamski, Hank Anderson & Connor","Gavin Reed, Elijah Kamski, Connor (Detroit: Become Human), Hank Anderson, Original Chloe | RT600, Tina Chen","Elijah Kamski & Gavin Reed are Siblings, Humor, Crackfic taken somewhat serious, but not very to be honest, gratuitious reference to memes, Gavin's inability to wink correctly, Elijah is less creepy, so many memes, Gavin is a disaster, Gavin is an internet sensation, Memelord Gavin, Memelord Elijah, AU sorta, Present Tense",English,2018-08-02,Completed,2018-08-02,2039,1/1,15,97,8,398,Gavin is a walking meme. This changes some things (but not much).
15534423,Shooter: Dodging Bullets,/users/LazyDaizy/pseuds/LazyDaizy,Mature,F/M,Riverdale (TV 2017),"Betty Cooper/Jughead Jones, Betty Cooper & Jughead Jones","Betty Cooper, Jughead Jones, FP Jones, Alice Cooper, Jellybean Jones, Kevin Keller, Reggie Mantle","Hurt/Comfort, Romance, Love, child birth, Angst, Smut",English,2018-08-02,Completed,2018-08-02,17587,1/1,80,209,19,2663,Shooter Coda Jughead deals with his fears as the birth of his child looms closer and how will he handle a tragedy that could claim the life of someone he loves.
15534402,Hearth and Home,/users/Rosage/pseuds/Rosage,General Audiences,Other,The Arcana (Visual Novel),Asra/Julian Devorak,"Asra (The Arcana), Julian Devorak, Mazelinka (The Arcana)","Family, Post-Canon",English,2018-08-02,Completed,2018-08-02,1231,1/1,null,15,null,66,"Asra is confronted with his past, or what it might have been with a family of former pirates."
15534387,The Ending,/users/Ivy_Sylph/pseuds/Ivy_Sylph,Teen And Up Audiences,M/M,Naruto,Senju Tobirama/Uchiha Madara,"Senju Tobirama, Uchiha Madara, Senju Hashirama, Senju Touka","Modern AU, Zombie, Apocalypse, Zombie Apocalypse, strange power, human with new ability, MadaTobi Week 2018, Day 5, crazy scientists",English,2018-08-02,Completed,2018-08-02,2834,1/1,null,15,null,189,"What does human fear the most? Losing their freedom? The Unknown? Misery? Pain? Loneliness? Failure? That’s all correct, however, some said the thing they fear the most is Dead. Unfortunately, compared to what the world fear, those things are meaningless. You ask me what does the world fear? Ah. It’s a simple question, my dear. The only thing that the world – this beautiful Earth, ever fear… is human. Theme: Crazy ScientistsFor: MadaTobiWeek2018 on Tumblr"
15534378,Tonight's Dinner,/users/ghostgirl19/pseuds/ghostgirl19,Teen And Up Audiences,F/M,Miraculous Ladybug,Adrien Agreste/Marinette Dupain-Cheng,"Marinette Dupain-Cheng, Adrien Agreste","snapchat gone wrong, Marinette takes the worst/best snap, depends on who you're asking, may get second-hand embarrassment, based on the shitshow that is me and my friends, adrienette - Freeform, Cross-Posted on Tumblr",English,2018-08-02,Completed,2018-08-02,1096,1/1,16,217,23,1185,"Marinette and Alya are bored in their classes, so they decide to spend the time by sending each other snaps on Snapchat. There's no way it can go wrong, even when Adrien and Alya's names are right next to each other on Marinette's phone...right?"
15534372,tamaki is pretty,/users/mnccys/pseuds/mnccys,General Audiences,M/M,Pu nohiroakademia | Boku no Hero Academia | My Hero Academia,Amajiki Tamaki/Toogata Mirio,"Toogata Mirio, Amajiki Tamaki","Sleepovers, Sleepy Boys, Mutual Pining, Pining, Crushes, Poetic, Gay Panic",English,2018-08-02,Completed,2018-08-02,1629,1/1,5,33,4,249,"Tamaki, tender and soft. Lovely and dreamlike and gentle. Tamaki is so pretty, and so close, and so easy. There's something so calming yet giddying about the thought of reaching out and simply brushing a knuckle against the pale skin of his neck. Mirio imagines the sensation for a split second and the warmth has returned to his cheeks tenfold."
15534366,You saved me,/users/Desusgirl1980/pseuds/Desusgirl1980,Mature,M/M,Walking Dead,Daryl Dixon/Jesus,"Daryl Dixon, Jesus (Walking Dead), Rick Grimes, Michonne (Walking Dead), Carol Peletier, Merle Dixon, Maggie Greene, Glenn Rhee, Denise Cloyd, Tara Chambler, Carl Grimes",,English,2018-08-02,Completed,2018-08-02,5006,1/1,4,14,null,291,A one shot Daryl is hurt in the most horrific way . Paul is the one who saves him .    A Desus oneshot
15534357,[(allYue )] Tu Zi Qing Ren (4),/users/Narcotic/pseuds/Narcotic,General Audiences,M/M,ONER,Ling Yue  - Relationship,Ling Chao  Yue Yue ,allYue  Ling Yue  Yang Yue  Bu Yue ,English,2018-08-02,Completed,2018-08-02,254,1/1,null,10,null,1230,
15534330,Crimson Fantasy,/users/bleedingsalt/pseuds/bleedingsalt,Explicit,M/M,Thor (Movies),Loki/Thor (Marvel),"Loki (Marvel), Thor (Marvel)","Masturbation, Fingerfucking, Anal Fingering, Blow Jobs, Walking In On Someone, First Time, Loki Has a Kink, And it's Thor's capes, Sibling Incest",English,2018-08-02,Completed,2018-08-02,1487,1/1,6,148,15,1430,"What can you do when you’ve got an extreme crush on your big brother and can’t tell him or have any way of making it stop? Right. You steal your brother’s clothes just to make this faint fantasy of him being with you a little more real. Or at least, that’s what Loki does."
15534324,Summer Nights,/users/nataliiila/pseuds/nataliiila,Not Rated,M/M,Voltron: Legendary Defender,Keith/Lance (Voltron),"Lance (Voltron), Keith (Voltron), Shiro (Voltron), Pidge | Katie Holt, Hunk (Voltron), Allura (Voltron), Coran (Voltron)","Fluff, Tooth-Rotting Fluff, Karaoke, One Shot, Puppy Love, keith is a whole pining mess, Mutual Pining, pidge built a karaoke machine, lance makes keith sing, this is so bad, i apologize in advance sksksks, shiro is such?? a dad????, Space Dad Shiro (Voltron), klance, klance fluff, its set in like season 1 where everything was still ok and not falling in shambles, I LOVE GREASE SO I HAD TO MAKE THEM SING SUMMER NIGHTS OK",English,2018-08-02,Completed,2018-08-02,2867,1/1,7,100,6,771,Keith doesn’t know if Pidge is just trying to kill him or if she genuinely loves Lance. Probably a little bit of both. She built a karaoke machine. In space. Because Lance kept protesting on not being able to sing freely without someone complaining about his world tours in his room at sleeping hours.
15534309,Twas the Night Before Christmas,/users/aimless38/pseuds/aimless38,Explicit,M/M,FAKE (Manga),"Dee Laytner/Randy ""Ryo"" MacLean","Dee Laytner, Randy ""Ryo"" MacLean, Carol ""Cal"" Baker, Victor ""Bikky"" Goldman",Fluff and Smut,English,2018-08-02,Completed,2018-08-02,7654,1/1,1,1,1,18,Stranded on Christmas Eve Dee and Ryo make the best of a bad situation.
15534294,the stars shine for you and only you.,/users/orphan_account/pseuds/orphan_account,General Audiences,M/M,Voltron: Legendary Defender,Keith/Lance (Voltron),"Allura (Voltron), Keith (Voltron), Lance (Voltron), Shiro (Voltron), Hunk (Voltron), Pidge | Katie Holt, Coran (Voltron)","Angst, klangst, Character Death, Flashbacks, short-ish, Stored Memories, Garrison - Freeform, Ghosts, Never Rivals, Shiro is a bad friend, soRRY OHMYGOD",English,2018-08-03,Completed,2018-08-03,792,1/1,null,2,1,107,"The death of Lance hurt the team a lot, but it effected Keith the most."
15534291,A nice picture of a smiley face,,Not Rated,,No Fandom,,,,English,2018-08-02,Completed,2018-08-02,0,1/1,null,2,1,9,
15534288,[(Di Wu Ren Ge /allShe )] room no.9 Di Qi Zhang,/users/dpsbiubiubiu/pseuds/dpsbiubiubiu,Not Rated,,"Di Wu Ren Ge , allShe , Yong She ",,,,English,2018-08-02,Completed,2018-08-02,267,1/1,null,10,null,2230,
15534282,Evaporation,/users/dragonshost/pseuds/dragonshost,General Audiences,F/F,Fairy Tail,Juvia Lockser/Mirajane Strauss,"Juvia Lockser, Mirajane Strauss","Humor, spa",English,2018-08-02,Completed,2018-08-02,225,1/1,null,2,null,18,Juvia finds herself in dire circumstances.
15534279,i'm your undoing,/users/echoofthewind/pseuds/echoofthewind,Explicit,M/M,Pu nohiroakademia | Boku no Hero Academia | My Hero Academia,Midoriya Izuku/Todoroki Shouto,"Todoroki Shouto, Midoriya Izuku","hey y'all midoriya's topping in this one, Dirty Talk, Rimming, Blow Jobs, just a drabble y'all but it's filthy as fuck, throws this at y'all because it's been forever since i've written anything, unbetaed, midoriya topping? what a dream come true",English,2018-08-02,Completed,2018-08-02,619,1/1,16,115,3,1112,"Izuku was topping tonight, and he wouldn’t stop until he had devoured every part of his lover."
15534273,"All of Paris Ships it, so Why Not Hawkmoth?",/users/Fangirls4eva/pseuds/Fangirls4eva,General Audiences,F/M,Miraculous Ladybug,Chat Noir/Ladybug (Miraculous Ladybug),"Gabriel Agreste, Papillon | Hawk Moth, Chat Noir (Miraculous Ladybug), Ladybug (Miraculous Ladybug), Heartbreaker(OC Akuma)","this is my first mlb fic, So I had to do it in hawkmoth's pov, i ship MariChat more than LadyNoir, but all of Paris ships this and I found it funny, I really don't know how to tag, just give the fic a chance",English,2018-08-02,Completed,2018-08-02,705,1/1,2,31,3,487,Hawkmoth finally akumatized someone that gives him exactly what he wishes for.
15534270,Good Morning?,/users/phanfren/pseuds/phanfren,Teen And Up Audiences,M/M,Phandom/The Fantastic Foursome (YouTube RPF),"Dan Howell/Phil Lester, Dan Howell & Phil Lester","Dan Howell, Phil Lester","Fluff, Implied Sexual Content, I Tried, Oops",English,2018-08-02,Completed,2018-08-02,1228,1/1,1,20,1,352,Dan hears a strange rustling sound from the kitchen and goes to check it out.
15534246,Hangover Sorcery,/users/dragonshost/pseuds/dragonshost,Teen And Up Audiences,F/M,Fairy Tail,Rogue Cheney/Kinana,"Rogue Cheney, Cubellios | Kinana","Alcohol, Hangover, Fluff",English,2018-08-02,Completed,2018-08-02,620,1/1,null,null,null,8,"Rogue parties a little too hard with Fairy Tail, and finds himself nursing a nasty hangover the next morning."
15534240,How to Say I Love You,/users/friendsofthemusain24601/pseuds/friendsofthemusain24601,Not Rated,M/M,Les Miserables - Victor Hugo,Enjolras & Grantaire (Les Miserables),"Enjolras (Les Miserables), Grantaire (Les Miserables)","it's cute, pretty gay, I'm posting this at two thirty in the morning so hopefully there aren't typos sorry, My OTP, Enjoltaire is the cutest thing ever, Friendly reminder to register to vote if you are of age!!!!!!, Fluff",English,2018-08-02,Completed,2018-08-02,562,0/1,3,9,1,63,"Enjolras and Grantaire are extremely happy. In fact, Enjolras might be in love with him, only he can't figure out how to express those three words."
15534237,Passing Through Fire,/users/mollymauks/pseuds/mollymauks,Explicit,Other,Critical Role (Web Series),Mollymauk Tealeaf/Caleb Widogast,"Mollymauk Tealeaf, Caleb Widogast","This be SMUT, filthy smut, PWP, smidge of angst though, bc caleb's involved so naturally, this thing got so long and so out of hand but it's DONE, PTSD, Trust Issues, Explicit Consent, alternating povs, Scars, idk what else to say y'all, just enjoy the filth, Molly is now Explicitly genderfluid in canon so I'm not tagging this as m/m, and for anyone wondering: he's explicitly nonbinary in this fic, but I don't go into detail with it in this one, that is for another fic, this one is just for porn and feelings",English,2018-08-02,Completed,2018-08-02,7646,1/1,14,108,13,881,"'Mollymauk tasted like fire, and for the first time in too long, Caleb Widogast was not afraid.'  Molly and Caleb's first time sleeping together, Caleb has some misgivings, and Molly helps him to work through them.  NSFW. Explicit content."
15534231,The Possibility of Happily Ever After,,Teen And Up Audiences,F/M,Timeless (TV 2016),"Wyatt Logan/Lucy Preston, Wyatt Logan & Lucy Preston","Lucy Preston, Wyatt Logan, Rufus Carlin, Jiya (Timeless), Denise Christopher, Connor Mason, Garcia Flynn, Carol Preston, Henry Wallace","lyatt, Fic Exchange, Post-Season 2 (Timeless), Canon Compliant",English,2018-08-02,Completed,2018-08-02,7159,1/1,5,22,5,247,"While on a reconnaissance mission in 1982, the team is presented with a chance to help Lucy get back what she's been fighting for and in doing so, her and Wyatt's future leads down an unexpected path. Takes place about six months after the Season 2 finale."
