work_id,title,author,rating,category,fandom,relationship,character,additional tags,language,published,status,status date,words,chapters,comments,kudos,bookmarks,hits,summary
15538836,"oh miss sugar pink, liquor liquor lips",/users/Ladyroyalkitty/pseuds/Ladyroyalkitty,Not Rated,"F/F, F/M, Multi",Pu nohiroakademia | Boku no Hero Academia | My Hero Academia,Ashido Mina/Hagakure Tooru,"Ashido Mina, Hagakure Tooru, Ojiro Mashirao (mentioned), Bakugou Katsuki (mentioned)","First Dates, Crushes, Drabble, Background Relationships, Mentioned Ojiro Mashirao/Hagakure Tooru - Freeform, Mentioned Polyamorous Bakusquad, Shopping, this is vv short but i can't find time to finish it, so whateveer, Not Beta Read, just 600 words of Mina bein gay for Tooru, that's all this is, How Do I Tag",English,2018-08-02,Completed,2018-08-02,646,1/1,null,4,null,38,"Mina has finally scored that first date with Tooru and tries to navigate through it without messing it all up. Or, Mina has it bad for Tooru and is just doing her best."
15538830,Day 2: College,/users/CosmoandWanda/pseuds/CosmoandWanda,General Audiences,F/F,Miraculous Ladybug,Chloe Bourgeois/Alya Cesaire,"Alya Cesaire, Chloe Bourgeois","College AU, Partners on a project, They not dating, yet - Freeform, AU Yeah AUgust (Miraculous Ladybug)",English,2018-08-02,Completed,2018-08-02,498,1/1,6,13,null,133,"Alya has really enjoyed her first year at college so far, classes are fun and, for the most part, her peers are great. There's one girl who just gets under her skin, and of course, they're partners for their final grade."
15538821,Fitness!Tom Holland x Reader,/users/Alboribo/pseuds/Alboribo,Teen And Up Audiences,F/M,tom holland - Fandom,Tom Holland & Reader,"Tom Holland, Reader","Short Story, One Shot",English,2018-08-02,Completed,2018-08-02,410,1/1,null,1,null,92,
15538800,In His Arms,/users/ImagineBeatles/pseuds/ImagineBeatles,Teen And Up Audiences,M/M,The Beatles (Band),John Lennon/Paul McCartney,,,English,2018-08-02,Completed,2018-08-02,1364,1/1,null,11,2,189,Paul has some trouble sharing a bed with John.
15538794,Searching,/users/Revasnaslan/pseuds/Revasnaslan,General Audiences,Gen,Voltron: Legendary Defender,Kolivan & Zarkon (Voltron),"Kolivan (Voltron), Zarkon (Voltron)","Childhood Friends, Hide and Seek, Baby Kolivan (Voltron), Baby Zarkon (Voltron), they/them pronouns for kolivan, Soft Galra",English,2018-08-02,Completed,2018-08-02,262,1/1,2,7,null,34,Kolivan searches for Zarkon in the gardens.
15538785,My Grumpy Boyfriend,/users/ImagineBeatles/pseuds/ImagineBeatles,Teen And Up Audiences,M/M,The Beatles (Band),John Lennon/Paul McCartney,,,English,2018-08-02,Completed,2018-08-02,1824,1/1,null,5,null,107,John is a little grumpy and Paul tries to cheer him up.
15538755,Your Dream Is My Dream,/users/GhostDetective/pseuds/GhostDetective,General Audiences,F/F,Downton Abbey,Sybil Crawley/Gwen Dawson,"Sybil Crawley, Gwen Dawson","Romance, Budding Love, Drabble, Pride",English,2018-08-02,Completed,2018-08-02,100,1/1,2,1,null,32,"Sybil touched Gwen’s arm, Gwen looked up sadly."
15538752,"Like Mother, Like Son",/users/sarcasticnotsardonic/pseuds/sarcasticnotsardonic,General Audiences,M/M,Shadowhunters (TV),"Magnus Bane/Alec Lightwood, Luke Garroway/Maryse Lightwood",,"Wedding, Fluff and Smut, hook ups, that awkward time when you catch your mom getting busy at your own wedding, but who can blame her, It's luke, get it Maryse",English,2018-08-02,Completed,2018-08-02,1090,1/1,4,150,7,954,"Just a short little thing based on a tweet I saw from @scribbleddream: ""alec and magnus looking for a closet to make out in at their reception and accidentally stumble onto maryse and luke lmao"" Thanks for the inspiration!"
15538746,I Want To Hold Your Hand,/users/ImagineBeatles/pseuds/ImagineBeatles,Teen And Up Audiences,Other,The Beatles (Band),John Lennon/Paul McCartney,,,English,2018-08-02,Completed,2018-08-02,3816,1/1,1,8,1,122,"Paul has been in love with John since they first met and has been dropping hints left and right, but John never caught on. Now he tries to be a bit more forward and writes John a song."
15538743,She is bloody brilliant,/users/Wayward_JasonLee/pseuds/Wayward_JasonLee,Teen And Up Audiences,M/M,"The Lord of the Rings - All Media Types, The Lord of the Rings (Movies)",Aragorn | Estel/Legolas Greenleaf,"Aragorn | Estel, Legolas Greenleaf, Original Male Character(s), Original Female Character(s)","Alternate Universe - 21st Century, Alternative Universe - Kingdom, Prince Legolas, First Meetings, First Kiss, Making Out, Dom/sub Undertones, Asexual Character, Aromantic, Fake/Pretend Relationship, I'm Sorry Tolkien, prince aragorn",English,2018-08-02,Completed,2018-08-02,1786,1/1,null,5,null,112,"Legolas is 20 a years old prince and is also supposed to get married at 21, he is not fond of the idea what so ever until his father introduces him to Amara and her brother aragon; princess and prince of gondor. What he doesn't know is that amara has no Intention of getting married to him for real..."
15538740,Caw caw Mothafuckers,/users/Eg_gu/pseuds/Eg_gu,Not Rated,,Pu nohiroakademia | Boku no Hero Academia | My Hero Academia,,"Midoriya Izuku, Bakugou Katsuki, Todoroki Shouto, Kirishima Eijirou, Iida Tenya, Ashido Mina, Kaminari Denki, Asui Tsuyu, Jirou Kyouka, Tokoyami Fumikage, Ojiro Mashirao, Satou Rikidou, Shouji Mezou, Kouda Kouji, Uraraka Ochako, Hagakure Tooru, Yaoyorozu Momo, Aoyama Yuuga, Sero Hanta, Class 1-A (My Hero Academia), Shinsou Hitoshi, Aizawa Shouta | Eraserhead, Yamada Hizashi | Present Mic, Yagi Toshinori | All Might, Kayama Nemuri | Midnight, Nedzu (My Hero Academia)","fuck endeavor, Fluff and Crack, they're birbs in this, that or a diffrent animal, nedzu is well nedzu, Bakugou Katsuki Swears A Lot, mineta died in a fire and no one noticed, Shinsou Hitoshi Replaces Mineta Minoru, Aizawa is so done, #protecticyhotboi2k18",English,2018-08-02,Completed,2018-08-02,140,1/1,1,7,null,99,"It's My Hero Academia but they're birbs or some other animal. This is crack, this is not meant to be serious.  caw caw mothafuckers i made this while on crack you can either believe that or not"
15538725,Best friends?,/users/newtmasmultifandom/pseuds/newtmasmultifandom,Mature,M/M,Original Work,Harry/Peter,,"Gay, Best Friends, Friends to Lovers, Alcohol, Kissing, Sex, Smut, Drunk Sex, First Time, First Kiss, Bi",English,2018-08-02,Completed,2018-08-02,13664,1/1,null,10,null,201,"”Push me against the wall in the boys’ bathroom, lock the door, no one will see.No one will hear.Let’s get these layers off, and let’s play.No one will see. No one will hear.Put your lips against mine, and stare deep into my eyes.Can you feel the beauty in this moment?”"
15538719,Pillow Forts and Birthday Kisses,/users/ImagineBeatles/pseuds/ImagineBeatles,Teen And Up Audiences,M/M,The Beatles (Band),John Lennon/Paul McCartney,,,English,2018-08-02,Completed,2018-08-02,5039,1/1,null,8,null,96,"For Paul’s fifteenth birthday, John decides Paul has to come over to celebrate his birthday together, just the two of them, and build a pillow fort."
15538704,Nebulas,/users/strangeandintoxicating/pseuds/Strange%20and%20Intoxicating%20-rsa-,Teen And Up Audiences,M/M,Voltron: Legendary Defender,Keith/Shiro (Voltron),"Keith (Voltron), Shiro (Voltron)","Slight Season 7 spoilers, Kissing, First Kiss, Soft and sweet Sheith, Why not sell the scraps of my heart to another fandom",English,2018-08-02,Completed,2018-08-02,2078,1/1,6,68,9,288," There was a dream Shiro had when he was younger: open expanses of space so dark it seemed to swallow the light, tendrils of reds and blues and purples cascading from the skies, the explosions of long-dead stars and the births of newly-formed nebulas that lived and died and lived again. There was the constant darkness, yes, but always filled by the light, yearning to break free.   A brief, but honest, conversation between Keith and Shiro."
15538701,Years Past,/users/Woodrokiro/pseuds/Woodrokiro,Teen And Up Audiences,F/M,Bleach,"Kuchiki Rukia/Kurosaki Ichigo, Kuchiki Rukia & Kurosaki Ichigo, Inoue Orihime/Ishida Uryuu, Abarai Ichika & Kurosaki Kazui","Kurosaki Ichigo, Kuchiki Rukia, Abarai Ichika, Kurosaki Kazui, Abarai Renji",,English,2018-08-02,Completed,2018-08-02,2532,1/1,2,15,null,126,"""They say my mother used to smile more. Is that the truth?"" Inspired by (tumblr) deathberryprompts prompt that had to include the words ""knife, bridge, and truth."" Follows the events of the manga ending, loosely."
15538692,"Keep Quiet, Dear",/users/ImagineBeatles/pseuds/ImagineBeatles,Explicit,M/M,The Beatles (Band),John Lennon/Paul McCartney,,,English,2018-08-02,Completed,2018-08-02,2203,1/1,1,13,null,193,John and Paul have a secret rendezvous in a bathroom stall.
15538686,Raising Rosie,/users/Fujioushijin/pseuds/Fujioushijin,Teen And Up Audiences,M/M,Sherlock (TV),"Sherlock Holmes/John Watson, Sherlock Holmes & John Watson","Rosamund Mary ""Rosie"" Watson, Sherlock Holmes, John Watson, Mrs. Hudson (Sherlock Holmes), Mycroft Holmes, Molly Hooper","Two Fathers, Adoption",English,2018-08-02,Completed,2018-08-02,722,1/1,3,18,2,403,"Years after the beloved Mary Morstan’s death,  Sherlock and John are still living together, raising a no-longer-infant Rosie together. Though when the two men test the boundries of their relationship, will their “family” change for the better or for the worse?"
15538680,"Hunt you down, eat you alive",/users/FanFicReader01/pseuds/FanFicReader01,Explicit,M/M,Detroit: Become Human (Video Game),Connor/Upgraded Connor | RK900/Gavin Reed,"Gavin Reed, Upgraded Connor | RK900","Rape/Non-con Elements, Threats of Rape/Non-Con, Threats of Violence, Dark, Disturbing Themes, animals from maroon 5 inspired me to write this shit, rip gavin, rk900 the fucking machine, hunter & prey, Hate Sex, Anal Sex, Rough Sex, Rape, im not proud of this fic or its tags, Songfic",English,2018-08-02,Completed,2018-08-02,2642,1/1,4,58,1,657,For no reason specifically Gavin is a deserter of the police forces and RK900 is send to hunt Gavin down
15538668,Life or Death,/users/parttimehuman/pseuds/parttimehuman,Teen And Up Audiences,,Teen Wolf (TV),Theo Raeken & Tara Raeken,"Theo Raeken, Tara Raeken, Theo Raeken's Mother, Dr. Geyer (Teen Wolf)",Angst with a Happy Ending,English,2018-08-02,Completed,2018-08-02,2133,1/1,3,14,null,77,"Theo is only five when he's asked to give his sick sister Tara his blood. It's a life-or-death-situation, that's what they tell him. Of course, Theo wants to help save his sister. What he doesn't know is that he isn't required to give all of his blood. Life or death was never about him. Still, he was ready."
15538665,That Charming Crooked Smile,/users/Kivea/pseuds/Kivea,Teen And Up Audiences,M/M,South Park,Kenny McCormick/Tweek Tweak,"Tweek Tweak, Kenny McCormick, Craig Tucker, Clyde Donovan, Token Black, Jimmy Valmer, Wendy Testaburger, Kyle Broflovski, Bebe Stevens, Nichole Daniels, Red (South Park), Eric Cartman","Alternate Universe - High School, Aged-Up Character(s), Fluff, Fluff and Humor, Humor, Getting Together, Haircuts, Flirting",English,2018-08-02,Completed,2018-08-02,13408,1/1,8,39,1,246,"Getting your hair cut was stressful.  For a long time, Tweek did it himself. He didn't trust hairdressers and he was too old to let his mother chose a 'style'. He planned on never letting anyone near it until he was nominated to Kenny as a good model to use to improve his skills.  He might've been able to mentally prepare himself to let the other blonde cut his hair, but nothing would prepare him for exactly how disarming that charming, crooked smile could be."
15538662,Winter Escapade,/users/ImagineBeatles/pseuds/ImagineBeatles,Teen And Up Audiences,M/M,The Beatles (Band),John Lennon/Paul McCartney,,,English,2018-08-02,Completed,2018-08-02,901,1/1,null,5,null,69,John and Paul have some fun in the snow on Valentine’s day.
15538653,I'll stay with you,/users/Fluffystrawberrymochi/pseuds/Wherestraykidsstay,General Audiences,M/M,Stray Kids (Band),Han Jisung | Han/Lee Minho | Lee Know,"Han Jisung | Han, Lee Minho | Lee Know, Lee Minho, Kim Woojin, Bang Chan, Seo Changbin, Lee Felix, Kim Seungmin, Yang Jeongin | I.N, Hwang Hyunjin","Canon Compliant, Friends to Lovers, Fluff and Angst, Angst, Fluff, Han Jisung | Han is Whipped, Cute, lee minho is whipped, Friendship, Unrequited Love, Not Actually Unrequited Love, Love Confessions, How Do I Tag, the author is sorry",English,2018-08-02,Completed,2018-08-02,2345,1/1,6,92,3,674,"Falling in love with someone you think you have no hope with is honestly the worst feeling ever. Just ask Jisung. He's maybe a little bit too in love with Minho but can't bring himself to tell him.  In which Jisung is a pining, whipped wreck who somehow manages to snag the cutest dancing god ever.  Or the author just wanted to celebrate us finally getting a fandom name by posting a fic. STAYS!!"
15538650,Month by Month,/users/Babystiles/pseuds/Babystiles,Not Rated,M/M,Teen Wolf (TV),Derek Hale/Stiles Stilinski,"Derek Hale, Stiles Stilinski, Sheriff Stilinski, Talia Hale, Laura Hale, Cora Hale, Scott McCall (Teen Wolf), Isaac Lahey, Allison Argent, Erica Reyes, Vernon Boyd","Mpreg, Alternate Universe - High School, Alternate Universe - Human, Alternate Universe - Everyone Lives/Nobody Dies, Sheriff Stilinski is a Good Parent, Good Boyfriend Derek Hale, Pregnant Stiles, teenage stiles, Established Relationship, Established Derek Hale/Stiles Stilinski, Teen Romance, Teen Derek Hale, Fluff",English,2018-08-02,Completed,2018-08-02,8198,1/1,11,178,27,2126,The nine months of Stiles' pregnancy
15538632,Tradition,/users/ImagineBeatles/pseuds/ImagineBeatles,Mature,M/M,The Beatles (Band),John Lennon/Paul McCartney,,,English,2018-08-02,Completed,2018-08-02,3443,1/1,null,8,1,114,"When John and Paul are in Scotland, visiting relatives of John, Paul decides to wear a kilt, as it is tradition. John, however, can’t keep his hands off him."
15538629,Lei Si Yu Mei Gui Hua (Xia )byGuo Dong,/users/Morpheus525/pseuds/Morpheus525,General Audiences,M/M,Cheng Kun ,,,,English,2018-08-02,Completed,2018-08-02,297,1/1,null,6,null,755,
15538626,Ghostly Trips,/users/ImagineBeatles/pseuds/ImagineBeatles,Teen And Up Audiences,M/M,The Beatles (Band),John Lennon/Paul McCartney,,,English,2018-08-02,Completed,2018-08-02,2053,1/1,1,5,null,117,There’s a reason why Paul falls on the stage that often. It’s because John trips him. Based on this post.
15538623,Perched,/users/ponchothor/pseuds/ponchothor,General Audiences,M/M,Marvel Cinematic Universe,"Bruce Banner/Thor, Hulk/Thor","Bruce Banner, Thor (Marvel), Hulk (Marvel)","Shoulder Rides, Established Relationship, Thor has Two hands, Cuddling & Snuggling",English,2018-08-02,Completed,2018-08-02,1207,1/1,8,48,4,308,Thor loves shoulder rides. Bruce isn't so sure about them.
15538608,It's Just a Matter of Time,/users/its_a_beautiful_deformity/pseuds/its_a_beautiful_deformity,Mature,F/F,Life Is Strange (Video Game),"Maxine ""Max"" Caulfield/Chloe Price","Maxine ""Max"" Caulfield, Chloe Price (Life Is Strange), Joyce Price, Warren Graham, Brooke Scott, Kate Marsh, Vanessa Caulfield, Ryan Caulfield, Original Characters, Rachel Amber","Fluff and Angst, Implied/Referenced Rape/Non-con, Suicidal Thoughts, Insomnia, Living Together, Hospitals, Blood and Injury, Sad and Happy",English,2018-08-02,Completed,2018-08-02,5145,1/1,2,14,3,207,Alternate ending in which both of them are happy even though a bit messed up in the head. I need to see them happy cause I'm weak.
15538605,White Arcades,/users/saintjunia/pseuds/saintjunia,General Audiences,M/M,Voltron: Legendary Defender,Keith/Shiro (Voltron),"Keith (Voltron), Shiro (Voltron)",,English,2018-08-02,Completed,2018-08-02,344,1/1,2,6,1,45,Keith tries to deal with loneliness after the Kerberos incident.
15538593,"Dude, Do Something!",/users/Optimistic_Avacado/pseuds/Optimistic_Avacado,Teen And Up Audiences,Gen,Pu nohiroakademia | Boku no Hero Academia | My Hero Academia,"Dabi & Toga Himiko, Dabi/Shigaraki Tomura | Shimura Tenko","Dabi (My Hero Academia), Toga Himiko, Shigaraki Tomura | Shimura Tenko, Kurogiri (My Hero Academia), Bubaigawara Jin | Twice","Periods, dabi is a living heating pad, toga is more murderous than usual, league of villains shenanigans, Slice of Life, i dont know how to fucking tag, dabi is best big bro",English,2018-08-02,Completed,2018-08-02,1045,1/1,10,128,9,770,Toga is on her period. Everyone is terrified. Dabi is a good big brother even though he can't fucking read.
15538590,Turtleducks,/users/honxrable/pseuds/honxrable,General Audiences,F/M,Avatar: The Last Airbender,Katara/Zuko (Avatar),"Katara (Avatar), Zuko (Avatar), Katara's and Zuko's Child(ren)","Zutara Week, Zutara Week 2018, Zutara",English,2018-08-02,Completed,2018-08-02,393,1/1,1,10,null,70,
15538587,Night after Night,/users/goddessoftheworld/pseuds/goddessoftheworld,Teen And Up Audiences,M/M,Eddsworld - All Media Types,Tom/Tord (Eddsworld),"Tom (Eddsworld), Tord (Eddsworld), Edd (Eddsworld), Patryck (Eddsworld), Eduardo (Eddsworld), Mark (Eddsworld), Jon (Eddsworld), Kim (Eddsworld), Katya (Eddsworld), Laurel (Eddsworld)",,English,2018-08-02,Completed,2018-08-02,8209,1/1,3,19,2,183,Company madness part 3 Based of Goddessofthworld's actual dad aucheck it out here http://goddessoftheworld.tumblr.com/tagged/actual%20dad%20au Continuation of:https://archiveofourown.org/works/11571210/chapters/25999101
15538584,First Day of School,/users/Amatia/pseuds/Amatia,Not Rated,,Pu nohiroakademia | Boku no Hero Academia | My Hero Academia,,Uraraka Ochako,,English,2018-08-02,Completed,2018-08-02,1123,1/1,null,null,null,17,
15538575,Death of a Bachelor,/users/Deviation/pseuds/Deviation,General Audiences,M/M,Pu nohiroakademia | Boku no Hero Academia | My Hero Academia,Aizawa Shouta | Eraserhead/Yagi Toshinori | All Might,"Aizawa Shouta | Eraserhead, Yagi Toshinori | All Might, Yamada Hizashi | Present Mic","Fluff, Crack Treated Seriously, Marriage Proposal, onesided erasermic - Freeform, 5+1 Things",English,2018-08-02,Completed,2018-08-02,5526,1/1,15,133,18,864,"So Shouta never exactly planned to be the marrying sort and everything about his personality screams ""Crazy Old Cat Lady"" instead of ""loving husband"" and sure, maybe Toshinori almost definitely deserves better than him and sure it seems like the world is against him proposing to Toshinori but well. Shouta is stubborn. And no matter how many times he fails at proposing, he won't stop trying until he hears an answer.  Or Five proposals that go hilariously wrong plus one that goes wonderfully right."
15538572,"New Year's Eve, 1964",/users/ImagineBeatles/pseuds/ImagineBeatles,Mature,M/M,The Beatles (Band),John Lennon/Paul McCartney,,,English,2018-08-02,Completed,2018-08-02,1612,1/1,1,5,null,69,John and Paul smoke and drink together on the balcony at New Year’s Eve.
15538569,Give a Rick a Bone,/users/5bluetriangles/pseuds/5bluetriangles,Explicit,M/M,Rick and Morty,Rick Sanchez/Morty Smith,"Rick Sanchez, Morty Smith","Puppy Play, Butt Plugs, Anal Play, Anal Fingering, Anal Sex, Collars, Doggy Style, lol, Sub Rick, Dom Morty, Light Dom/sub, i think light?, Dom/sub, Just to be safe, pup rick is naughty sometimes, morty is forgiving, there isn't enough rickmorty puppy play and no pup rick so here take this, everyone pls consider pup rick i love him, it took forever ugh my writing takes so long even for things that aren't that great :/",English,2018-08-02,Completed,2018-08-02,8769,1/1,4,25,3,384,If a Morty plays his cards right; he can get his Rick to play along with almost any game. Including being a pet.
15538563,Card Games,/users/Woodrokiro/pseuds/Woodrokiro,Teen And Up Audiences,F/M,Bleach,"Kuchiki Rukia/Kurosaki Ichigo, Kuchiki Rukia & Kurosaki Ichigo",,,English,2018-08-02,Completed,2018-08-02,1012,1/1,null,3,null,67,"For a man with such boundless energy, Ichigo is capable of extraordinary stillness. Written for deathberryprompts' ""queen"" last year."
15538542,All A Dream Anyways,/users/RadicalVee/pseuds/RadicalVee,General Audiences,M/M,Yuri!!! on Ice (Anime),"Katsuki Yuuri/Victor Nikiforov, Katsuki Yuuri & Victor Nikiforov","Victor Nikiforov, Katsuki Yuuri",,English,2018-08-02,Completed,2018-08-02,1200,1/1,null,5,null,147,"Depressed Viktor stumbled into a dream. What, or rather who does he find?"
15538527,Astraphobia,/users/unknownfangirl1304/pseuds/unknownfangirl1304,General Audiences,M/M,The Maze Runner RPF,"Ki Hong Lee/Will Poulter, Thomas Brodie-Sangster/Dylan O'Brien(mentioned)","Will Poulter, Ki Hong Lee, Dylan O'Brien, Thomas Brodie-Sangster","Fluff, Ki Hong is a softie, Astraphobia, Comfort, Tooth-Rotting Fluff, Ki Hong has a crush on Will, They're cute, Will has a crush on Ki Hong, enjoy, I Wrote This Instead of Sleeping, Cross-Posted on Tumblr",English,2018-08-02,Completed,2018-08-02,617,1/1,null,3,null,36,Ki Hong has Astraphobia and he asks Will to comfort him when a storm hits.
15538524,Lady Catelyn and a Targaryen Prince,/users/Sleepy_moon29/pseuds/Sleepy_moon29,Explicit,F/M,"A Song of Ice and Fire - George R. R. Martin, Game of Thrones (TV), A Song of Ice and Fire & Related Fandoms",Jon Snow/Catelyn Stark,"Jon Snow, Catelyn Tully Stark","Facials, Sex, Oral Sex, Vaginal Sex, Plot What Plot/Porn Without Plot, Dirty Talk, Alternate Universe - Rhaegar won, Smut",English,2018-08-02,Completed,2018-08-02,3389,1/1,14,64,12,2093,A short fic involving Jon and Catelyn in an underground spring in Winterfell
15538521,Their Story,/users/teeteeAOS/pseuds/teeteeAOS,Mature,,Agents of S.H.I.E.L.D. (TV),"Phil Coulson/Melinda May, Phil Coulson & Skye | Daisy Johnson, Lance Hunter/Bobbi Morse","Phil Coulson, Melinda May, Melinda May's Mother, William May, Robert Coulson, Julie Coulson, Jemma Simmons, Leo Fitz, Grant Ward, John Garrett, Victoria Hand, Alphonso ""Mack"" Mackenzie, Bobbi Morse, Lance Hunter, Yo Yo Rodriguez, Skye | Daisy Johnson, Jasper Sitwell, Felix Blake, Billy Koenig, Sam Koenig, Eric Koenig, L.T. Koenig, Anne Weaver, Antoine Triplett",,English,2018-08-02,Completed,2018-08-02,2643,1/1,1,16,1,328,May and Coulson have a lot of things to deal with - from being SHIELD agents to being parents to their little guy. This is a story of how they try to be the best parents in the universe while saving the world.
15538512,Virgo Rising,/users/rainbowwrites/pseuds/rainbowwrites,General Audiences,Gen,Final Fantasy XV,,"Lunafreya Nox Fleuret, Ravus Nox Fleuret","Character Study, Alternate Universe - Modern Setting, Luna-centric, Drabble",English,2018-08-02,Completed,2018-08-02,2045,1/1,null,2,null,23,"Some couldn’t see it through the desolation, but Lunafreya always could. She would help them see it too, in whatever way she could."
15538503,At least she's not drinking,/users/paula_roisa/pseuds/paula_roisa,Mature,F/F,Jane the Virgin (TV),Luisa Alver/Rose Solano,"Luisa Alver, Rose Solano","Smut, Fluff and Humor, Oral Sex, Office Sex, Season/Series 01",English,2018-08-02,Completed,2018-08-02,1136,1/1,5,12,1,250,"It happens on 01x02, basically what happened (in my head) after the screen got blank"
15538476,Sheet Thoughts,/users/Woodrokiro/pseuds/Woodrokiro,Mature,F/M,Bleach,"Kuchiki Rukia/Kurosaki Ichigo, Kuchiki Rukia & Kurosaki Ichigo",,"implied cunnilingus, Vagina talk wow",English,2018-08-02,Completed,2018-08-02,545,1/1,1,2,null,63,"""Ichigo leans down and he's not sure he's ever seen anything more beautiful."" Written for one of deathberryprompts' prompts ""underneath"" last year and this head canon I had forever. M for a sexual situation."
15538470,The Goddamn Sweetest Thing,/users/luastardust/pseuds/StarsAndSkies,Explicit,F/M,"Mass Effect Trilogy, Mass Effect - All Media Types",Zaeed Massani/Female Shepard,"Zaeed Massani, Female Shepard (Mass Effect)","Smut, Explicit Sexual Content, Explicit Language, Morning Sex, Plot What Plot/Porn Without Plot, Porn with Feelings, Angst and Fluff and Smut, Vaginal Fingering, Vaginal Sex, Cunnilingus, Established Relationship, Age Difference, Older Man/Younger Woman, Shameless Smut, Oral Sex, Kissing, Kitchen Sex",English,2018-08-02,Completed,2018-08-02,1942,1/1,4,25,null,null,"Zaeed Massani and Jo Shepard; pancake batter, honey, and a frustrated breakfast."
15538461,those four words.,/users/Idnis/pseuds/Idnis,Teen And Up Audiences,M/M,Six of Crows Series - Leigh Bardugo,Jesper Fahey/Wylan Van Eck,"Jesper Fahey, Wylan Van Eck","Tumblr Prompt, Prompt Fill, Fluff, Kissing, Cheese, because they are in love",English,2018-08-02,Completed,2018-08-02,1399,1/1,17,56,7,273,Jesper had said them once before. Though the setting wasn't quite the same.
15538452,Sleep Child..,/users/Raging_Nerd/pseuds/Raging_Nerd,Mature,,Detroit: Become Human (Video Game),,Upgraded Connor | RK900,"Original Character(s), Minor Character Death, Violence, Mild Gore",English,2018-08-02,Completed,2018-08-02,459,1/1,2,2,2,59,"RK900-1 #313 000 001-1 System Scan…Scan Complete.……Zero Errors Found.   Or, a hunter finds his prey."
15538425,A Sucker for Pun-ishment,/users/Gotcocomilk/pseuds/Gotcocomilk,Teen And Up Audiences,M/M,Pu nohiroakademia | Boku no Hero Academia | My Hero Academia,Midoriya Izuku/Todoroki Shouto,"Midoriya Izuku, Todoroki Shouto, Aizawa Shouta | Eraserhead, Bakugou Katsuki, Class 1-A (My Hero Academia)","Fluff and Humor, Tooth-Rotting Fluff, Humor, Bad Pick-Up Lines, Bad Puns, and Good puns, but there isn't a tag for that, I'm upset about this, Shoto gets hit with a joke quirk, And can't stop making jokes, no betas we die like men",English,2018-08-02,Completed,2018-08-02,1682,1/1,22,396,53,1997,"A crackling of frost cut him off, gathering across Shoto’s fingertips and over his arm. He stretched out his hand, palm up, towards Bakugou.    “Do you need some ice for that burn?”   Otherwise known as: Shoto gets hit with a quirk that forces him to tell jokes. They are all bad, but the pick-up lines are worse."
