work_id,title,author,rating,category,fandom,relationship,character,additional tags,language,published,status,status date,words,chapters,comments,kudos,bookmarks,hits,summary
15625122,Lions Den,/users/RampageOneShots/pseuds/RampageOneShots,Not Rated,Other,"Batman Eternal (Comics), Batman and Robin Eternal (Comics), Batman (Comics), Red Hood: Lost Days","Pamela Isley & Jason Todd, Pamela Isley/Jason Todd, Harleen Quinzel & Jason Todd, Harleen Quinzel/Jason Todd, Edward Nygma/Jason Todd, Edward Nygma & Jason Todd, Joker/Jason Todd, Joker (DCU) & Jason Todd, Jason Todd/Bruce Wayne, Jason Todd & Bruce Wayne, Talia al Ghul/Jason Todd, Talia al Ghul & Jason Todd","Jason Todd, Pamela Isley, Harleen Quinzel, Edward Nygma, Bruce Wayne, Talia al Ghul, Red Hood, Batman","Jason Todd-centric, Jason Todd Has Issues, Jason Todd is Red Hood",English,2018-08-09,Completed,2018-08-09,907,1/1,3,54,1,578,"When the villains of Arkham first see the red hood being dragged into Arkham they thought they were going crazy, the batman had thrown one of his own, his ex-robin to the wolves, to the Joker. Everything stopped when the Joker started cackling his famous laugh everyone saw the feared red hood shrink, “Why is he here,” Pamela asks Nygma coming out of her shock saying the first thing that comes to her mind “he’s clearly underage” “This is the red hood aka ex-Robin” Starts one of the guards smirking before walking out and leaving “take nice care of him” “My my my little red” the Joker cackles as he saunters towards the red hoods frozen form “looks like daddy bats finally gave you up” “Joker” Nygma tries realizing how young the red hood was, he looked to be sixteen “leave him alone- God that means he must have died at thirteen” “So” The Joker starts pulling a file out of nowhere “you look to have the previously dead syndrome, just like the old times right Jay Jay” (I love Jason/Talia motherly love so you will see Talia being an overprotective mother to Jason)"
15625119,Apple Juice,/users/turntechClockwork/pseuds/turntechClockwork,General Audiences,Gen,Homestuck,,"Dave Strider, Dirk Strider","recalculate, Artificial Intelligence, ai-stuck, dave is a robot, Fanfiction of Fanfiction, Apple Juice, i friggin love this story so i wanted to write for it ;w;",English,2018-08-09,Completed,2018-08-09,992,1/1,1,14,null,60,"""One morning it’s water, the next milk, the next apple juice, the next orange juice, and then back to water. Each day you have to drink the glass of the given liquid while Dirk Strider records the precise time it takes for you to drink it."" The first time Dave drinks apple juice, from the story Recalculate by amaranthinecanicular! <33"
15625107,See the butterfly in the blood,/users/chanderson/pseuds/chanderson,Mature,"F/M, M/M",The Beatles (Band),"John Lennon/Paul McCartney, John Lennon/Yoko Ono, Paul McCartney/Original Character(s)","John Lennon, Paul McCartney, Original Female Character(s)","Self-Harm, Blood, Angst, Hurt/Comfort, Implied/Referenced Homophobia",English,2018-08-09,Completed,2018-08-09,2819,1/1,7,23,1,351,"
“You do not understand, schatzi. But maybe one day you will see,” she whispers, “that pain makes pleasure.”
 In which John finds out alcohol isn't the only way Paul numbs his pain."
15625104,Sometimes you just need a cry,/users/5SecondsofCake/pseuds/5SecondsofCake,Not Rated,"F/M, M/M",5 Seconds of Summer (Band),"Luke Hemmings/Original Female Character(s), Sierra Deaton/Luke Hemmings, Calum Hood/Ashton Irwin","Luke Hemmings, Sierra Deaton, Ashton Irwin (Briefly Mentioned), Calum Hood (Briefly Mentioned)","I'm projecting my own problems, Breakups, Crying, Hurt/Comfort, Emotional Hurt/Comfort, Sad, then happy, venting, I Wrote This Instead of Sleeping, Getting Together, Not Famous, Alternate Universe - High School",English,2018-08-09,Completed,2018-08-09,953,1/1,null,1,null,29,"Luke Hemmings and Sierra Deaton have been friends for years, however there has always been something there.They both feel it but are too afraid to act on it.Plus there is Luke having a long time girlfriend whomst he is madly and deeply in love with, so what happens when Luke shows up at Sierras door step with red rimmed eyes and a heavy heart. Will they finally act on these emotions?"
15625095,King of the Night,/users/Amiria_Raven/pseuds/karasun013,Teen And Up Audiences,M/M,Haikyuu!!,Akaashi Keiji/Bokuto Koutarou,"Akaashi Keiji, Bokuto Koutarou","Hanahaki AU, Kadupul, coughing up flowers, i don't know how to tag this guys but tell me if you want me to tag something ok, Romance, Fluff, Angst, Hurt/Comfort",English,2018-08-09,Completed,2018-08-09,14023,1/1,2,40,5,380,"
Oh, so that’s what it is. 
 
I’m in love with Bokuto-san.
 The bitterness of petals and blood weighed heavily on his tongue, but not as heavily as the next leaden weight that settled in the pit of his stomach. 
I’m in love with Bokuto-san...and he doesn’t love me back.
"
15625086,Missing,/users/The_Fandom_Changer/pseuds/The_Fandom_Changer,General Audiences,M/M,Grand Theft Auto V,Michael De Santa/Trevor Philips,"Trevor Philips, Michael De Santa","Sad, I Will Go Down With This Ship",English,2018-08-09,Completed,2018-08-09,750,1/1,null,3,null,60,Well this was sad and unnecessary.
15625083,One True Mate,/users/mythicalinker/pseuds/mythicalinker,Explicit,M/M,Teen Wolf (TV),"Derek Hale/Stiles Stilinski, Derek Hale/Original Male Character(s)",,"Werewolf Mates, Forced Relationship, Anal Sex, Barebacking, Angst and Hurt/Comfort",English,2018-08-09,Completed,2018-08-09,6178,1/1,11,20,2,1041,"It was not because Derek was not ready or he thought Stiles was not the right guy for him but because his inner wolf believed that their mate was not Stiles but someone else. Someone who already staked a claim on them a long time ago. ""Derek?"" a familiar voice called in a husky voice that automatically caused his insides to ablaze with submission and want. It felt like his insides were melting and became empty, craving to be filled as soon as possible or else he will die from the overwhelming hunger and heat. He wanted to flee but like a Pavlovian response, he slowly looked back praying with his entire being that this was just a nightmare of some sort because this cannot be real. It must be a shape-shifter or doppelganger because there was no way that his mate and former Alpha found him but there he was standing in the doorway, au naturel in the flesh."
15625074,Unsavory,/users/hoodienanami/pseuds/hoodienanami,Teen And Up Audiences,"F/M, Gen",Batman - All Media Types,Selina Kyle/Edward Nygma,"Selina Kyle, Edward Nygma","Drabble, Mentions of creepy people on the internet, Crack Treated Seriously",English,2018-08-09,Completed,2018-08-09,606,1/1,null,4,null,32,"The internet is full of unsavory people who do and say unsavory things. Luckily for Selina, she has someone in her life who will ruin the lives of the people who talk about her like that online."
15625050,Hush-Hush,/users/DeerintheMoon/pseuds/DeerintheMoon,Explicit,F/F,Overwatch (Video Game),"Sombra/Widowmaker | Amelie Lacroix, Sombra & Widowmaker | Amelie Lacroix","Sombra (Overwatch), Widowmaker | Amelie Lacroix, Reaper | Gabriel Reyes","Cunnilingus, Vaginal Fingering, Fingerfucking, Finger Sucking, Semi-Public Sex, Quiet Sex, Hiding, Multiple Orgasms",English,2018-08-09,Completed,2018-08-09,1985,1/1,null,22,null,518,Widowmaker and Sombra find a back room to get down to business in while on a mission.Quiet sex in hiding.
15625029,This can be fixed with Ducktape,/users/sintaley/pseuds/sintaley,Mature,,Undertale (Video Game),,"Sans (Undertale), Papyrus (Undertale)","Blood and Injury, Blood Loss, Accidents",English,2018-08-09,Completed,2018-08-09,1195,1/1,2,4,null,24,"Blue has noticed that for months, Papyrus always goes down to the basement after he is done reading him his bedtime story. One day, Blue went to check it out for himself. He found a machine, and blueprints for said machine. Wanting to help, Blue took matters into his own hands, eventually causing things to go horribly wrong."
15625023,thesis,/users/Winter_Lantern/pseuds/Winter_Lantern,General Audiences,Gen,Bloodborne (Video Game),Micolash Host of the Nightmare & Rom the Vacuous Spider,"Micolash Host of the Nightmare, Rom the Vacuous Spider","Drabble, Pre-Canon, Friendship, human!Rom",English,2018-08-10,Completed,2018-08-10,100,1/1,2,3,null,38,the only thing more dubious than their theorems are their ethics.
15625020,What Could Have Been,/users/Farlaka/pseuds/Farlaka,Teen And Up Audiences,Gen,Detroit: Become Human (Video Game),Hank Anderson & Connor,"Connor (Detroit: Become Human), Hank Anderson, Sumo (Detroit: Become Human), Cole Anderson","Suicide, Implied/Referenced Suicide, Everyone is Dead, Canonical Character Death, Death, Sad, Sad Ending, Angst, Hurt, Hurt No Comfort, this is sad, Bad Ending, Depressed Hank Anderson, Suicidal Thoughts, How Do I Tag, Heavy Angst, Angst and Feels, Character Death, Alcohol, Guns, Drunk Hank Anderson",English,2018-08-09,Completed,2018-08-09,708,1/1,null,9,1,65,This is the ending where Hank commits suicide after Connor dies many times and remains a machine. All I did was embellish the scene and add a few things to Hank's character. I hope you enjoy!
15624990,Bee's Love Rose's,/users/CharlieNitram/pseuds/CharlieNitram,Mature,M/M,Transformers - All Media Types,Bumblebee/Knock Out,"Bumblebee (Transformers), Knockout, Bulkhead (Transformers), Breakdown (Transformers)","Transformers as Humans, Transformers Prime - Freeform",English,2018-08-09,Completed,2018-08-09,1446,1/1,null,8,null,75,
15624972,you've longed to know me,/users/littletrenchcoatangel/pseuds/littletrenchcoatangel,Teen And Up Audiences,M/M,"Captain America (Movies), Marvel Cinematic Universe, Marvel","James ""Bucky"" Barnes/Steve Rogers, James ""Bucky"" Barnes & Steve Rogers","James ""Bucky"" Barnes, Steve Rogers","Internet, Surprise Kissing, Holding Hands, cute shit, i dont remember how to tag okay leave me alone",English,2018-08-09,Completed,2018-08-09,4641,1/1,9,136,10,892,"User: 19barnacleboy10, 10:02pm: captain america/steve rogers is the best of all known avengers members and anyone who disagrees can physically fight me Or: Steve and Bucky defend each other online, completely unaware that they're talking to each other."
15624954,seven a.m.,/users/siyeons_kr/pseuds/siyeons_kr,Not Rated,F/F,LOONA (Korea Band),Jung Jinsol | Jinsoul/Kim Jungeun | Kim Lip,"Jung Jinsol | Jinsoul, Kim Jungeun | Kim Lip, Viian Wong | ViVi, Kim Jiwoo | Chuu, Ha Sooyoung | Yves",,English,2018-08-09,Completed,2018-08-09,1044,1/1,1,74,3,370,"based off of this tweet of my own; https://twitter.com/redroom_co/status/1023988486767038465 jungeun has a 7am class, and the girl sitting next to her, jinsoul, pours a monster energy drink into her coffee while saying “i’m going to die” before drinking the whole thing."
15624936,The Perfect Suitor,/users/randomdork11/pseuds/randomdork11,General Audiences,F/M,Once Upon a Time (TV),"Belle/Rumplestiltskin | Mr. Gold, Belle & Rumplestiltskin | Mr. Gold","Rumpelstiltskin, Belle, Rumplestiltskin | Mr. Gold","The Dark Castle (Once Upon a Time), Fluff in the Dark Castle (Once Upon a Time), Trappings of society, Little bit of angst, Episode: s01e12 Skin Deep, Romance, Angst, Humor",English,2018-08-09,Completed,2018-08-09,1402,1/1,2,14,1,172,"In the Dark Castle, Rumpelstiltskin and Belle have a conversation about suitors, propriety, and the trappings of nobility. Brief little one-shot that is full of fluff and (as always with me) a healthy dose of angst"
15624933,Chocolate and Cookie Dough,/users/LokianaWinchester/pseuds/LokianaWinchester,General Audiences,M/M,Harry Potter - J. K. Rowling,Sirius Black/Remus Lupin,"Remus Lupin, Sirius Black, Harry Potter","Fluff, Domestic Fluff, post-full-moon, Parents, the single fluffiest thing I ever, Wrote",English,2018-08-09,Completed,2018-08-09,815,1/1,4,50,3,329,Just a little post-full-moon fluff. Toothrottingly sweet :)
15624930,Exchange,/users/nochuga/pseuds/nochuga,Mature,M/M,bangtansonyeondan | Bangtan Boys | BTS,"Jeon Jungkook/Min Yoongi | Suga, side 2seok - Relationship, Side Minjoon - Relationship","Jeon Jungkook, Min Yoongi | Suga, Kim Seokjin | Jin, Jung Hoseok | J-Hope, Kim Namjoon | RM, Kim Taehyung | V, Park Jimin (BTS)","Alternate Universe - Criminals, Minor Character Death, Rivalry, Jeon Jungkook is Whipped, Guns, Violence, Light Angst, Hoseok brings back DOPE MV feelings, Explosions, Min Yoongi | Suga Is a Bad Bitch",English,2018-08-09,Completed,2018-08-09,2777,1/1,2,8,null,253,Jungkook gets a new job that he didn't applied for.Yoongi don't do the partners in crime shit. Or: The criminal au that this ship deserves. Maybe?
15624921,i just want to see (you),/users/drmsqnc/pseuds/drmsqnc,General Audiences,F/M,Detroit: Become Human (Video Game),"Markus (Detroit: Become Human) & Reader, Markus (Detroit: Become Human)/Reader","Reader, Markus (Detroit: Become Human)","its your annual break from the sea of angst, Fluff, starring suave robo, Drabble",English,2018-08-09,Completed,2018-08-09,810,1/1,3,52,2,265,flying high
15624900,Shape of You,/users/mythicalinker/pseuds/mythicalinker,Explicit,"F/M, M/M, Multi",Teen Wolf (TV),"Derek Hale/Stiles Stilinski, Derek Hale/Isaac Lahey, Vernon Boyd/Derek Hale/Erica Reyes, Vernon Boyd/Erica Reyes, Isaac Lahey/Scott McCall",,"Alternate Universe - Human, Sex Toys, Power Bottom Derek Hale, Top Stiles Stilinski, Threesome - F/M/M, Oral Sex, Barebacking, Alternate Universe - Sex Shop",English,2018-08-09,Completed,2018-08-09,13298,1/1,3,35,7,1335,It was all Lydia's fault. It was she who gave him the Harry (the dildo that he was so crazy about) at the first place. The problem was he already reached the point where the toy was no longer enough to satisfy him. He was possessed by an uncontrollable desire to be fucked by the real Harry.  Good news was the guy was just a few blocks away from his apartment. The bad news? The guy was fucking straight.
15624894,Talk to Her,/users/a_fangirl_stuff/pseuds/a_fangirl_stuff,Teen And Up Audiences,F/M,Supernatural,Jensen Ackles & Reader,"Jensen Ackles, Jared Padalecki, Reader",,English,2018-08-09,Completed,2018-08-09,2439,1/1,null,1,null,54,"Jensen and the reader know each other from high school, and when she starts working at Supernatural as a costume designer, both of them want to talk to each other but as they ended their friendship badly none wants to take risks."
15624888,You're not alone.,/users/Rephrase_the_World/pseuds/Rephrase_the_World,General Audiences,Gen,"Batman: Bad Blood (2016), Batman - All Media Types, Batman (Comics)","Tim Drake & Damian Wayne, Tim Drake & Dick Grayson & Jason Todd & Bruce Wayne & Damian Wayne, Talia al Ghul & Damian Wayne, Damian Wayne & Everyone","Damian Wayne, Tim Drake, Bruce Wayne, Dick Grayson, Jason Todd, Talia al Ghul (mentioned), Duke Thomas (mentioned)","Canonical Character Death, Brotherly Love, Brotherly Bonding, Brotherly Affection, familial concern, Family Feels, Family Drama, Family Fluff, Adopted Sibling Relationship, big brother Tim Drake, Damian Wayne is Robin, Damian Wayne Feels, Damian Wayne-centric, Tim Drake is Red Robin, Literary References & Allusions, Random Literary References for the Win, Random comic book references for the win too, I Wrote This Instead of Sleeping, Batfamily Feels, No editing we die like mne",English,2018-08-09,Completed,2018-08-09,1903,1/1,13,53,2,397,"“We are all alone, born alone, die alone, and—in spite of True Romance magazines—we shall all someday look back on our lives and see that, in spite of our company, we were alone the whole way.”"
15624876,"Detroit: What's In There, Anyway?",/users/Makammathun/pseuds/Makammathun,Teen And Up Audiences,,Detroit: Become Human (Video Game),,,"Worldbuilding, aka quantic dream you left us with so many fuckin holes wyd, mentions of:, Alcohol, Drugs, biocomponents?, actually using my fucking college education in psychology, a lot of my fics will likely draw from this worldbuild so i've decided to put it in one spot",English,2018-08-09,Completed,2018-08-09,1522,1/1,null,2,2,36,"so help me god, david cage. a basic overview of what androids are made up of, how some behaviors can be explained, etc. not a necessary read for my fics, but a backdrop of info I felt like providing and working through!"
15624849,Midnight Tea,/users/goldfishoflove/pseuds/goldfishoflove,General Audiences,F/M,The Adventure Zone (Podcast),"Barry Bluejeans/Lup, Lup & Taako (The Adventure Zone)","Lup (The Adventure Zone), Taako (The Adventure Zone), Barry Bluejeans","Fluff, Sibling Bonding",English,2018-08-09,Completed,2018-08-09,1188,1/1,4,45,3,178,"It's a good thing elves don't sleep, because after the Legato Conservatory performance, the twins need to talk."
15624816,My First Choice,/users/xonceinadream/pseuds/xonceinadream,Explicit,M/M,Glee,Blaine Anderson/Sebastian Smythe,"Blaine Anderson, Sebastian Smythe",,English,2018-08-09,Completed,2018-08-09,2163,1/1,3,36,2,286,Sebastian can't be Blaine's affair anymore. He ends it. He's prepared to stay strong when Blaine knocks on his door two months later. Then Blaine hands him a key.
15624801,"On the Edge, Meeting in the Middle",/users/chaostheoryy/pseuds/chaostheoryy,General Audiences,M/M,Mission: Impossible (Movies),Benji Dunn/Ethan Hunt,"Ethan Hunt, Benji Dunn, Solomon Lane","Hurt/Comfort, Alternate Universe - Canon Divergence, Alternate Ending, Fix-It, Friends to Lovers, Post-Canon, Spoilers, SPOILERS FOR FALLOUT, Fluff and Angst",English,2018-08-09,Completed,2018-08-09,2109,1/1,21,125,13,790,"**SPOILERS FOR MISSION IMPOSSIBLE: FALLOUT** Following the massive fight with Walker and the successful retrieval of the detonation key, Ethan wakes up to find Benji at his bedside. To his dismay, Ethan quickly realizes there’s something Benji isn’t telling him."
15624786,I'm Sorry,/users/Colormysoultraurig/pseuds/Colormysoultraurig,Teen And Up Audiences,F/M,Riverdale (TV 2017),"Jughead Jones/Veronica Lodge, Jughead Jones & Veronica Lodge","Jughead Jones, Veronica Lodge, Archie Andrews, Betty Cooper","Suicide Attempt, Songfic, GOD IM SO SORRY",English,2018-08-09,Completed,2018-08-09,1920,1/1,null,5,null,232,"Hold on, I still want you, Come back, I still need you  BEWARE SUICIDAL THOUGHTS AND ACTIONS! Jeronica songfic for Hold on by Chord Overstreet"
15624756,Prompt 10 (Renzei 5),/users/Yoselin/pseuds/Yoselin,Teen And Up Audiences,F/M,Villainous Nights (Visual Novel),Renzei/MC,"Renzei Feng, MC",,English,2018-08-09,Completed,2018-08-09,1980,1/1,null,null,null,2,Name used is Valkyrie. Originally posted to Tumblr. Prompt: “How about a dance?”
15624738,For You,/users/Anime_Pee/pseuds/Anime_Pee,Teen And Up Audiences,M/M,Voltron: Legendary Defender,Keith/Lance (Voltron),"Keith (Voltron), Lance (Voltron)","Omorashi, Bladder Control, Watersports, Kink Negotiation, Established Relationship, Established Keith/Lance (Voltron), Asexual Keith (Voltron)",English,2018-08-09,Completed,2018-08-09,1069,1/1,null,39,2,838,Keith tries Lance's kink.
15624693,Remember Me,/users/JustAnotherFan05/pseuds/JustAnotherFan05,General Audiences,F/M,"Marvel Cinematic Universe, Iron Man (Movies)",Tony Stark/Pepper Potts,"Tony Stark, Pepper Potts, Avengers (briefly mentioned)","AU, Pepperony - Freeform, Iron Man - Freeform, Parent Tony Stark, Parent Pepper Potts, Pregnant Pepper Potts, Domestic Fluff, Married Life, One Shot, One Shot Collection, Remember Me from Coco",English,2018-08-09,Completed,2018-08-09,1488,1/1,null,14,1,199,"Tony Stark has a lot of secret powers, but this secret power was especially useful towards one person and one person alone.  'For even when I'm far away, I hold you in my heart... I sing this secret song to you each night we are apart.' - Remember Me from Coco."
15624684,[(KKH/TK)] Wei Xian Guan Xi,/users/Thoki/pseuds/Thoki,Explicit,M/M,KinKi Kids,,,,English,2018-08-09,Completed,2018-08-09,428,1/1,null,6,null,824,
15624681,Replay,/users/TheLittleSongbird/pseuds/TheLittleSongbird,Teen And Up Audiences,M/M,Voltron: Legendary Defender,"Keith/Shiro (Voltron), Keith & Shiro (Voltron)","Keith (Voltron), Shiro (Voltron)","Hurt/Comfort, Emotional Hurt/Comfort, Post-Traumatic Stress Disorder - PTSD, Clones, Post-Season/Series 06, The major character death is only a technicality, Love Confessions, Shiro remembers every clone death suffered and Keith helps him through it, that's it that's the fic, Canon Compliant, until season 7 starts at least, so canon compliant for like a day, better late than never",English,2018-08-09,Completed,2018-08-09,3849,1/1,2,55,11,299,"The first clone dies on the slab. Shiro knows because he remembers.When Shiro gets his memories back, he gets the memories of every clone before as well."
15624663,Hot Hot Heat,/users/wildfrancium/pseuds/wildfrancium,Explicit,M/M,Check Please! (Webcomic),"Eric ""Bitty"" Bittle/Kent ""Parse"" Parson/Jack Zimmermann","Eric ""Bitty"" Bittle, Kent ""Parse"" Parson, Jack Zimmermann","Threesome - M/M/M, Trans Character, Trans Kent, Plot What Plot/Porn Without Plot, Just Sex, Established Relationship, Gags, Butt Plugs, Anal Sex, Vaginal Sex, Oral Sex, Rimming, Light Bondage, Crying",English,2018-08-09,Completed,2018-08-09,1019,1/1,2,23,1,457,"Jack and Eric taking care of their boyfriend, Kent."
15624660,The Coffee Scent (That One B'day),/users/reginanicolecky/pseuds/reginanicolecky,General Audiences,F/M,"NU'EST, Wanna One (Band), Produce 101 (TV)",Hwang Minhyun/Moon Yael | OC,"Hwang Minhyun, Ong Seongwu, Park Woojin, Lee Daehwi, Moon Yael | OC","Romance, Friendship, Older Woman/Younger Man, Birthday Presents",English,2018-08-09,Completed,2018-08-09,1363,1/1,null,null,null,30,
15624651,"See If You Can Withstand This, Heroes!!",/users/decadentbynature/pseuds/decadentbynature,Explicit,,Pu nohiroakademia | Boku no Hero Academia | My Hero Academia,,"Midoriya Izuku, Iida Tenya, Todoroki Shouto, Bakugou Katsuki, Ojiro Mashirao, Kaminari Denki, Kirishima Eijirou, Tokoyami Fumikage","Tentacles, Tentacle Sex, Tentacle Rape, Tentacle Monsters, Multiple Penetration, Double Penetration in One Hole, Double Penetration, Double Anal Penetration, Triple Penetration, Triple Penetration in One Hole, Non-Consensual Blow Jobs, Blow Jobs, Stomach Deformation, Cum Inflation, belly bulge, Rape/Non-con Elements, Rape, Implied Midoriya Izuku/Todoroki Shouto, implied tododeku - Freeform",English,2018-08-09,Completed,2018-08-09,3162,1/1,8,95,12,3319,"Monoma tosses a weird orb into the boy's locker room, which sprouts a bunch of tentacles. You can probably guess what happens after that"
15624642,write my way out,/users/KeeperofSeeds/pseuds/KeeperofSeeds,General Audiences,Gen,"Star Wars - All Media Types, Star Wars Prequel Trilogy",,Obi-Wan Kenobi,"Jedi Temple, Force Visions, Timey-Wimey, The Force, Bittersweet, Diary/Journal, selflessness",English,2018-08-09,Completed,2018-08-09,452,1/1,4,59,2,443,Obi-Wan decides it’s time to record his memories from the Vision.
15624627,H.O.P.E.,/users/DarkColdSummer/pseuds/DarkColdSummer,Teen And Up Audiences,Gen,Undertale (Video Game),"Chara & Frisk (Undertale), Frisk & Undyne (Undertale), Chara & Undyne (Undertale)","Chara (Undertale), Frisk (Undertale), Undyne (Undertale), Sans (Undertale), Papyrus (Undertale), Mentioned: - Character, Monster Kid (Undertale), Toriel (Undertale), Asgore Dreemurr, Flowey (Undertale), Muffet (Undertale), Alphys (Undertale), Mettaton (Undertale)","Nonbinary Chara and Frisk, nonbinary chara, Nonbinary Frisk, Acronyms, For literally anything and everything, Undertale Genocide Route, Undertale Neutral Route, Incomplete Undertale Pacifist Route, Lots of Neutral Routes, But only in mentions, undyne is a good friend, Chara Is A Good Friend, sans hates frisk, and Chara, Not for Sans fans, Undyne's house burns down, as usual, Character Death, Temporary Character Death, Hurt/Comfort, Chara thinks they are a demon, Frisk thinks they are a demon too, Genocide with a reason, Friendship, bad times, breakdowns, Frisk (Undertale) Needs a Hug, Get Dunked On, Dunking, Undertale Saves and Resets, Revenge-oriented Chara, Undyne Remembers Resets, Sans Remembers Resets, Undyne forces Frisk to stay Underground, Sans Swearing, i dunno, Maybe a little slight, Angst, Summary What Summary?, I cannot write summaries, Unhealthy Coping Mechanisms, on Chara's end of stuff, Genocide isn't a Healthy Coping Mechanism, Out of Character, Out of Chara-cter, Out of Character Chara, Out of Character Undyne, Out Of Character Sans, Why is the last OoC tag the only one that exists, Well... the first one exists too but..",English,2018-08-09,Completed,2018-08-09,2595,1/1,4,17,null,118,"Being killed by Flowey over and over at the end of every run has take its toll on Frisk and Chara. Driven with (reasonable) rage, Chara goes on mass genocide to kill the monsters for how much Frisk has suffered, needing to take out their anger somewhere. Genocide run over, and Undyne remembers. But more pressing, why is Frisk's Base HP only at 2?"
15624600,A Good Ritual,/users/SemiParenthesis/pseuds/SemiParenthesis,Explicit,M/M,Pocket Monsters | Pokemon - All Media Types,"Original Male Character/Original Male Character, Hellgar | Houndoom/Original Character(s)","Original Pokemon Trainer(s), Hellgar | Houndoom","Lemon, Yaoi, Pokephilia, Porn With Plot, Demons, Demon Summoning, Human/Pokemon Relationship(s)",English,2018-08-09,Completed,2018-08-09,11612,1/1,null,22,2,780,"A young man receives a book, that perhaps he shouldn't use. But demons aren't real, right? Lemon. Gay, yaoi, pokephilia. Human X demon houndoom."
