work_id,title,author,rating,category,fandom,relationship,character,additional tags,language,published,status,status date,words,chapters,comments,kudos,bookmarks,hits,summary
15631656,A Butterfly's Synthesis,/users/ShinMinRin/pseuds/ShinMinRin,General Audiences,Gen,bangtansonyeondan | Bangtan Boys | BTS,Park Jimin (BTS)/Reader,"Jung Hoseok | J-Hope, Park Jimin (BTS), Reader","Mentioned Jeon Jungkook, Mentioned Kim Taehyung | V, Inspired by Jimin's dance in his BTS x Bog Sock video, Also inspired by Own It dance practice",English,2018-08-09,Completed,2018-08-09,2067,1/1,null,7,null,50,"""It truly was a sight to behold.A heavenly sight, a show that no-one could take their eyes off of, that no-one would take their eyes off of. It truly was beautiful, the way the light flooded the practice room and caressed his fair and glowing skin; how it shone down on him and made a halo around him. He truly was beautiful"" Jimin was dancing and you couldn't stop watching him."
15631653,I Need U,/users/dab7_nctzen/pseuds/dab7_nctzen,Explicit,M/M,bangtansonyeondan | Bangtan Boys | BTS,Min Yoongi | Suga/Park Jimin,"Min Yoongi | Suga, Park Jimin (BTS), Park Chanyeol, Byun Baekhyun, Mark Lee (NCT), Chwe Hansol | Vernon, Bae Jaewook | Benji, Jung Yoonoh | Jaehyun, Kim Hanbin | B.I, Kim Taehyung | V, Lee Jooheon",,English,2018-08-09,Completed,2018-08-09,4107,1/1,1,28,6,462,"Jimin grabbed onto Yoongi's hand, dragging him to his room upstairs. He pushed the older onto his bed while he ran into his closet, closing the doors so he could get changed into the dress. Yoongi waited patiently until the younger was finished.  When Jimin announced he was done Yoongi laughed and waited for the doors to open. Jimin stepped out after a second and Yoongi felt himself choke on his tongue."
15631650,Sunset Beach,/users/KameraEye/pseuds/KameraEye,Explicit,M/M,Pocket Monsters | Pokemon - All Media Types,Hakuryu | Dragonair/Original Human Character(s),"Original Pokemon Trainer(s), Hakuryu | Dragonair","Nude Beach, Blow Jobs, Rimming, Sloppy Makeouts, Tail Sex, Consensual Sex",English,2018-08-09,Completed,2018-08-09,1031,1/1,null,2,null,149,"Hoping to lose his virginity, Mark goes to a nudist beach he heard through the grapevine. But a creature lurking in the water has other plans for him..."
15631644,Bob and Helen Fuck in the Beans Aisle While I Disassociate in the Bathroom,/users/Daryll_B_Consequences/pseuds/Daryll_B_Consequences,Mature,F/M,Incredibles (Pixar Movies),"Bob ""Mr. Incredible"" Parr/Helen ""Elastigirl"" Parr","Bob ""Mr. Incredible"" Parr, Helen ""Elastigirl"" Parr",,English,2018-08-09,Completed,2018-08-09,489,1/1,7,4,null,148,Read the title
15631638,Tumble,/users/the_sinnamon_roll_writes/pseuds/the_sinnamon_roll_writes,Teen And Up Audiences,,Hetalia: Axis Powers,,"Sweden (Hetalia), Denmark (Hetalia), Finland (Hetalia), Norway (Hetalia), Iceland (Hetalia), Hungary (Hetalia)","it gets sad, idk about the title i just pulled it out of my ass",English,2018-08-09,Completed,2018-08-09,4786,1/1,null,5,null,29,A simple picnic gone wrong.
15631611,Late Night Planning,/users/melgibson87/pseuds/Scribbling%20Mama,Teen And Up Audiences,F/M,Miraculous Ladybug,"Adrien Agreste/Marinette Dupain-Cheng, Adrien Agreste & Alya Cesaire & Marinette Dupain-Cheng & Nino Lahiffe","Adrien Agreste, Marinette Dupain-Cheng, Nino Lahiffe","Miraculous Fluff Month, Miraculous Fluff Month 2018, fluff month, Fluff, lots of fluff, Mentioned Alya Cesaire, late night, birthday planning, Surprise Party, Cuddling, Purring, Love, Romance, Literal Sleeping Together, Sleepy Cuddles, Sleepy Kisses, Dating, Post-Reveal Adrien Agreste/Marinette Dupain-Cheng",English,2018-08-09,Completed,2018-08-09,730,1/1,6,46,2,504,"Alya's birthday is coming up, so the others are working late nights to plan an epic party for her. As they finish up the final details, Marinette and Adrien spend the night cuddling on her chaise. During this time, lots of cuddles happen as well as another surprise Marinette would like to give Alya with Adrien's help as Chat."
15631608,you are the only exception,/users/daegued/pseuds/daegued,Not Rated,M/M,NCT (Band),Lee Donghyuck | Haechan/Mark Lee,"Lee Donghyuck | Haechan, Mark Lee (NCT)","this is sad, I Wrote This Instead of Sleeping, I'm Sorry, not even donghyuck's personality just mine, Happy Ending, insecure donghyuck",English,2018-08-09,Completed,2018-08-09,535,1/1,3,28,3,456,"it's 1:05 AM, the thoughts usually hit him at 3.Donghyuck is dissatisfied with himself and mark is there to chase all the bad thoughts away."
15631599,A Special Day,/users/sorrow_key/pseuds/sorrow_key,Teen And Up Audiences,Gen,Pandora Hearts,"Elliot Nightray & Vincent Nightray, Vincent Nightray & Leo Baskerville, Elliot Nightray & Leo Baskerville","Elliot Nightray, Vincent Nightray, Leo Baskerville, Snowdrop (Pandora Hearts)","Cats - free-form, slight gore, is it cannibalism if it's a chain?, Bitter-sweet, implied alcohol, happy birthday elly, Humor, Canon-Typical Character Death, Elliot is the embodiment of that meme with the sword fighter holding the cat pass it on",English,2018-08-09,Completed,2018-08-09,1046,1/1,null,2,1,29,"Elliot tenses and tightens his hold on the cat that thankfully stays calm. There's no way he'd have such bad luck as to run into a chain or a murderer here, and yet he's wary. Better to be safe than sorry. Carefully changing his hold on the cat to a one-armed one, Elliot draws his sword. “Who's there?” He demands. (in which cats are incorrigible and so is Vincent, and old men remember the dead.)"
15631593,Just One Look,/users/frostvalkyries/pseuds/frostvalkyries,General Audiences,M/M,"The Flash (TV 2014), Arrow (TV 2012)",pre Oliver Queen/Barry Allen,"Oliver Queen, Malcolm Merlyn, Ra's al Ghul, Nora Allen, Barry Allen, Joe West","Short Story, 570 words, Angst, Death tagged even though hes not really dead lol, 3x09 ""the climb"", Soulmates AU, super late olivarry week submission",English,2018-08-09,Completed,2018-08-09,570,1/1,null,14,2,151,Soulmate AU: you see your soulmate's life flash before your eyes
15631590,Replay,/users/wreathed/pseuds/wreathed,Mature,M/M,Black Sails,Captain Flint/Thomas Hamilton,"Thomas Hamilton, Captain Flint (Black Sails)","Ficlet, Pre-Series, London, Missing Scene",English,2018-08-09,Completed,2018-08-09,914,1/1,4,30,null,223,"Thomas and James, this time."
15631575,I'll Always Lend An Ear,/users/MzzMal/pseuds/MzzMal,General Audiences,F/M,I Love Yoo (Webcomic),Hirahara Kousuke/Yoo Shin-ae,"Hirahara Kousuke, Yoo Shin-Ae","Fluff, feel good stuff, Domestic, Married Couple",English,2018-08-09,Completed,2018-08-09,833,1/1,2,8,null,121,The sound of a car making its way up the driveway and keys being turned in the front door alerted the brunette that was sitting at the dining room table.
15631572,Blame,/users/Sunnygalaxy/pseuds/Sunnygalaxy,Teen And Up Audiences,,Voltron: Legendary Defender,Lance & Pidge | Katie Holt,"Pidge | Katie Holt, Lance (Voltron), Matt Holt",Is kinda focus on Plance but its not romantic,English,2018-08-09,Completed,2018-08-09,1781,1/1,null,8,null,105,"* Contains possible spoilers of season 7*That’s how everyone's life should be. Video games, parties, laughter, studies ... But they were in a war, and they depended on each other to survive. Matt didn’t need to say the exact words, but he understood. This was his fault."
15631563,Bring Me Back,/users/Usagidesu/pseuds/Usagidesu,General Audiences,,Aldnoah.Zero (Anime & Manga),,"Slaine Troyard, Nova Troyard (OC), Althea Troyard (OC), Aiki Mamoru (OC)","One Shot, epilouge",English,2018-08-09,Completed,2018-08-09,921,1/1,null,1,null,26,"There was a child in his door step to called him ""Daddy?!"""
15631551,Ashes,/users/AntiochArrow/pseuds/AntiochArrow,Teen And Up Audiences,F/F,"DCU, Catwoman (Comics), Suicide Squad (2016)",Harleen Quinzel/Holly Robinson,"Holly Robinson, Harleen Quinzel",,English,2018-08-09,Completed,2018-08-09,0,1/1,null,null,null,14,
15631545,Running in the Halls,/users/the_sinnamon_roll_writes/pseuds/the_sinnamon_roll_writes,Teen And Up Audiences,F/M,Hetalia: Axis Powers,Hungary/Prussia (Hetalia),"Hungary (Hetalia), England (Hetalia), Prussia (Hetalia), Russia (Hetalia)","idk how i liked my ending here it felt a bit weak, but it is what it is",English,2018-08-09,Completed,2018-08-09,1830,1/1,null,4,null,31,Something isn't quite right with Eliza and Gilbert.
15631542,Colours of My Rainbow,/users/HereStrikesDawn/pseuds/HereStrikesDawn,Teen And Up Audiences,"Multi, Other",Steven Universe (Cartoon),"Connie Maheswaran/Steven Universe, Rose Quartz/Greg Universe, Ruby/Sapphire (Steven Universe), Pearl/Rose Quartz (Steven Universe)","Steven Universe, Pearl (Steven Universe), Amethyst (Steven Universe), Garnet (Steven Universe), Peridot (Steven Universe), Greg Universe","Hurt/Comfort, Sick Character, Family Feels, Family Bonding, light-hearted breaks from angst, first SU fic, Mystery",English,2018-08-09,Completed,2018-08-09,1271,1/1,1,15,1,203,"It happened to Steven once. His glowing green gem. Nobody knew what it was.But it came back, and this time it (whatever it was) was here to stay."
15631536,You're a Roller Coaster,/users/Skeletonflowers/pseuds/botanistlester,Teen And Up Audiences,M/M,Phandom/The Fantastic Foursome (YouTube RPF),Dan Howell/Phil Lester,"Dan Howell, Phil Lester","Roller Coasters, Amusement Parks, First Meetings, Meet-Cute, Holding Hands, Phil Lester Father of Lesbians, hes not actually a dad, but his friends appointed him their dad, Flirting, Fluff, Tooth-Rotting Fluff",English,2018-08-09,Completed,2018-08-09,2325,1/1,11,161,5,675,Phil goes to an amusement park with his friends but ends up having to ride a roller coaster with a stranger because he's the third wheel.
15631518,Hurt,/users/wolfsbanex/pseuds/wolfsbanex,General Audiences,M/M,NCT (Band),"Dong Si Cheng | WinWin/Nakamoto Yuta, Lee Donghyuck | Haechan/Mark Lee","Dong Si Cheng | WinWin, Nakamoto Yuta, Lee Donghyuck | Haechan, Lee Taeyong, Mark Lee (NCT), Moon Taeil","Canon, Non AU, Jealousy, Insecurities, Arguing, Light Angst, Making Up, Kissing, Fluff, Idiots in Love, Angst with a Happy Ending, Love Confessions, they are just really whipped for each other, Tooth Rotting Fluff",English,2018-08-09,Completed,2018-08-09,1405,1/1,3,67,4,1122,"Yuta doesn’t try to show it, but Sicheng rejecting his affection does hurt him. A lot."
15631509,Cassadaga,/users/apostapal/pseuds/apostapal,Teen And Up Audiences,M/M,Overwatch (Video Game),Reaper | Gabriel Reyes/Soldier: 76 | Jack Morrison,"Reaper | Gabriel Reyes, Soldier: 76 | Jack Morrison","Angst with a Happy Ending, Reconciliation, Implied/Referenced Alcohol Abuse/Alcoholism, Implied/Referenced Character Death, spirituality, Post-Fall of Overwatch, Reaper76bigbang",English,2018-08-09,Completed,2018-08-09,12387,1/1,24,70,11,499,Jack Morrison spent years lost in a haze and when he finally tries to pull himself out he goes looking for guidance in the strangest of places. But he never expects to face his past--and Death itself--when a probably-fake medium sends him on a spiritual quest across North America.
15631506,Imagining Me (Remembering You),/users/themomentofdavyprentiss/pseuds/themomentofdavyprentiss,General Audiences,M/M,Voltron: Legendary Defender,"Keith/Shiro (Voltron), Keith/Kuron (Voltron)","Keith (Voltron), Shiro (Voltron), Kuron (Voltron)","Hurt/Comfort, Angst with a Happy Ending, Post Season 6, not season 7 compliant, you better enjoy it while it lasts, alternative title to this fic:, how many soft touches can I fit into 2k without being repetitive, throwing this out here the day before s7 drops, so yall have about 10 hours to enjoy this before canon makes this irrelevant",English,2018-08-09,Completed,2018-08-09,1901,1/1,2,45,5,310,"Shiro wakes up in his new body, only to find himself full of memories he can’t quite reach—there, but fuzzy and unrecognizable. When Keith approaches Shiro with a plan to recreate the important moments he missed, he discovers he might not have be the only one to have harbored feelings for the new Black Paladin."
15631503,The Alley,/users/WillGrammer/pseuds/WillGrammer,Explicit,M/M,Blue Bloods (TV),Jamie Reagan/Noble Sanfino,"Jamie Reagan, Noble Sanfino","Plot What Plot/Porn Without Plot, Anal Fingering, Anal Sex, Teasing, Bad Flirting, Sweat, Unsafe Sex, Public Sex, Established Relationship, Bottom Noble is my jam, top jamie, Dirty Talk, One Shot, Long Shot",English,2018-08-09,Completed,2018-08-09,1699,1/1,null,7,2,226,What's more romantic than fucking your boyfriend in a dark alley in the middle of the night?
15631500,A Knock at the Door,/users/the_sinnamon_roll_writes/pseuds/the_sinnamon_roll_writes,General Audiences,M/M,Hetalia: Axis Powers,Germany/North Italy (Hetalia),"North Italy (Hetalia), America (Hetalia), Germany (Hetalia)","I know very little about the military I did my best, Sad but with a happy ending",English,2018-08-09,Completed,2018-08-09,2712,1/1,2,9,1,66,Ludwig gets called to action.
15631491,Souvenir,/users/ScatteredEsprit/pseuds/ScatteredEsprit,General Audiences,F/M,Voltron: Legendary Defender,Matt Holt/Nyma,"Matt Holt, Nyma (Voltron)",Season 6 Spoilers,English,2018-08-09,Completed,2018-08-09,521,1/1,null,2,null,21,"Matt was ready to go home, but Nyma wasn't ready to tell him goodbye."
15631488,Navy Blue is the New Black,/users/tellmeyourownpolitik/pseuds/tellmeyourownpolitik,Mature,F/F,Holby City,Serena Campbell/Bernie Wolfe,"Bernie Wolfe, Serena Campbell","Masturbation, OITNB - Freeform, my first ever fanfic boiiiisssss",English,2018-08-09,Completed,2018-08-09,1966,1/1,5,62,null,787,"Following on from the first kiss on the theatre floor... Serena realises what we all know in that Bernie Wolfe is a fucking goddess, and she starts her three day orange is the new black binge!!!"
15631482,Propriety,/users/wreathed/pseuds/wreathed,General Audiences,F/M,Black Sails,Miranda Barlow/Captain Flint,"Captain Flint (Black Sails), Miranda Barlow","Ficlet, Pre-Series, London, Missing Scene",English,2018-08-09,Completed,2018-08-09,445,1/1,2,12,null,105,Immediately after James and Miranda’s carriage scene has reached its assumed conclusion.
15631473,mariah & anne,/users/Dev_Bee/pseuds/Dev_Bee,Teen And Up Audiences,Gen,Be More Chill - Iconis/Tracz,None,"Jeremy's Mom (Be More Chill), Jeremy Heere, Michael Mell, Michael's Moms (Be More Chill)","Drabble, Angst, Hurt No Comfort, Emotional Hurt, Guess what it's called projection",English,2018-08-09,Completed,2018-08-09,348,1/1,2,4,null,62,Jeremy's mom was an enigma.
15631461,Paper in a bottle,/users/duvvang/pseuds/duvvang,Not Rated,Other,Poptropica (Video Game),,"Mordred (Poptropica), Princess Elyana","Short One Shot, i havent. posted anything here in forever i am SO sorry (but its not like anyone cares lol)",English,2018-08-09,Completed,2018-08-09,243,1/1,2,2,null,7,Elyana shows Mordred something she taught from the locals of the arturian kingdom.
15631455,summer lovin',/users/intertwiningwords/pseuds/intertwiningwords,Not Rated,"F/F, Multi",Harry Potter - J. K. Rowling,Cho Chang/Luna Lovegood/Ginny Weasley,"Cho Chang, Ginny Weasley, Luna Lovegood","AU, Non magic AU, beach, Meeting, Pining, Mutual Pining, Bisexual Ginny Weasley, Lesbian Cho Chang, Pansexual Luna Lovegood",English,2018-08-09,Completed,2018-08-09,3412,1/1,null,3,null,58,"au. cho, luna, & ginny all work at the same beach club for a summer and grow closer than they ever intended."
15631449,Complicated,/users/ibreatheakaashi/pseuds/ibreatheakaashi,Teen And Up Audiences,M/M,Pu nohiroakademia | Boku no Hero Academia | My Hero Academia,Bakugou Katsuki/Midoriya Izuku/Todoroki Shouto,"Todoroki Shouto, Midoriya Izuku, Bakugou Katsuki","Established Relationship, Post-Canon, Sickfic, Domestic Fluff, Alternate Universe - College/University",English,2018-08-09,Completed,2018-08-09,1995,1/1,2,43,6,543,Midoriya is sick and the boyfriend take a errand run....
15631446,Walk the Beat,/users/TheKiwiBird/pseuds/TheKiwiBird,General Audiences,Gen,World Wrestling Entertainment,,"Tyler Breeze, Fandango (Professional Wrestling), Mojo Rawley, Elias Samson, Dolph Ziggler, Finn Balor | Prince Devitt",Gift Fic,English,2018-08-09,Completed,2018-08-09,1559,1/1,2,16,null,101,"Tyler Breeze and Fandango find adjusting to the Superstar Shake-up harder than they thought. Unlike Smackdown Live and all their passably well-groomed locker rooms, RAW is a madhouse of fashion violations and general nonsensical fashion choices. As they travel the halls, they encounter several superstars, and one that catches Tyler's eye for a particular reason."
15631440,Alpha and Omega,/users/shepherdbook/pseuds/shepherdbook,Teen And Up Audiences,F/M,bangtansonyeondan | Bangtan Boys | BTS,Jeon Jungkook/Original Female Character(s),"Jeon Jungkook, Original Female Character(s), Original Male Character(s)","Alternate Universe - Magic, Alternate Universe - Harry Potter Setting, Romance, Drama, Action/Adventure, Violence, Mild Gore, Death, Murder",English,2018-08-09,Completed,2018-08-09,24140,1/1,null,4,null,43,"Taken from @thelibraryofbts on tumblr because I'm bad at summaries: A crack sounds in the silence of Jeon Jeongguk's apartment. From that unsuspecting, infinitesimal moment, everything he once knew changes."
15631431,I Know You,/users/SupremeLeaderRen13/pseuds/SupremeLeaderRen13,Teen And Up Audiences,F/M,"Star Wars - All Media Types, Star Wars Sequel Trilogy","Kylo Ren/Rey, Rey/Ben Solo | Kylo Ren, Leia Organa & Ben Solo | Kylo Ren","Ben Solo | Kylo Ren, Kylo Ren, Rey (Star Wars), Leia Organa, Han Solo","Work In Progress, Angst",English,2018-08-09,Completed,2018-08-09,2618,1/1,2,7,1,184,"""You still don't think I'm real, do you?""In a dream or a nightmare, they've seen each other before."
15631428,you always knew how to push my buttons,/users/okteviaskaikru/pseuds/okteviaskaikru,Not Rated,F/M,The 100 (TV),Bellamy Blake/Clarke Griffin,"Clarke Griffin, Bellamy Blake, Octavia Blake","Alternate Universe - Modern Setting, Neighbors, Enemies to Lovers, One Shot, Fluff, Angst, a little bit, Jealousy, clarke looks hot and bellamy is mad about it, Trapped In Elevator, other main characters are mentioned, the usuals - Freeform, and also cage is their shitty cheap landlord, Makes Sense, also, there is, Pining, mild drug use, as in there's barely a joint, just blame murphy ok, Cool",English,2018-08-09,Completed,2018-08-09,3001,1/1,3,178,5,1848,"“This is your fault!” Clarke Griffin announced pacing back and forth on the tiny tiled floor, her heels clicking and filling the elevator with a firm echo. “Woah, how is this my fault?” Clarke stopped and placed her hands on her hips. “If it wasn’t for your stupid comments and blatantly waisting my time, we wouldn’t be here right now! God, you’re so immature,” she shouted “Oh please, I’m not immature,” he narrowed his eyes putting air quotes around the word. His gesture was shadowed by the tiny emergency light that kicked in after the power went out and the fluorescent ones were killed.   or, neighbors and enemies, Clarke and Bellamy, get stuck in their apartment building’s elevator when the power goes out, causing Clarke to miss her date. After the lights go out, the truth comes out."
15631413,A Very Special Shirt,/users/the_sinnamon_roll_writes/pseuds/the_sinnamon_roll_writes,Teen And Up Audiences,M/M,Hetalia: Axis Powers,Denmark/Norway,"Denmark (Hetalia), Norway (Hetalia)","I love the Nordics, Fluff, a wee bit nsfw at the beginning there",English,2018-08-09,Completed,2018-08-09,1024,1/1,null,7,1,49,A sweet night with Lukas and Mathias
15631410,The summer of our discontent,/users/BrightestSun/pseuds/BrightestSun,General Audiences,Gen,Miraculous Ladybug,Alix Kubdel/Sabrina Raincomprix,"Alix Kubdel, Sabrina Raincomprix","Coming Out, Fluff, Sweet, Summer Camp, Asexual Character, asexual alix, Lesbian",English,2018-08-09,Completed,2018-08-09,2345,1/1,2,5,1,46,"Alix and Sabrina are camp counselors. Alix finds herself annoyed that Sabrina's spending a lot of time pampering to the needs of some snot nosed bratty princess wannabe just because she yells loudly. AU Yea August day 9 - summercampThis fic is posted a little later than I'd wanted but still within the time limit, I'm hoping I can do the same tomorrow."
15631404,Discovery,/users/Vondrakenhof/pseuds/Vondrakenhof,General Audiences,Gen,Pu nohiroakademia | Boku no Hero Academia | My Hero Academia,"Midoriya Inko & Midoriya Izuku, Midoriya Izuku & Yagi Toshinori | All Might, Midoriya Izuku & Uraraka Ochako","Midoriya Inko, Midoriya Izuku, Yagi Toshinori | All Might, Uraraka Ochako","Inko watches Izuku's acceptance letter, Inko worries, Inko is so proud of her boy, And so glad he has friends, set in season one",English,2018-08-09,Completed,2018-08-09,1444,1/1,10,49,7,442,"While cleaning Izuku's room, Inko finds his acceptance video. Watching it allows her to put a few things together."
15631392,Something New,/users/tabbytabbytabby/pseuds/tabbytabbytabby,Teen And Up Audiences,M/M,Teen Wolf (TV),Liam Dunbar/Theo Raeken,"Theo Raeken, Liam Dunbar, Melissa McCall, David Geyer, Dr. Geyer (Teen Wolf), Jenna Geyer, Liam Dunbar's Mother, Derek Hale","Getting Together, First Meetings, First Kiss, Age Difference, Fluff, Insecurity, Derek Hale & Theo Raeken Friendship, Mentioned Derek Hale/Stiles Stilinski - Freeform, Doctor Theo - Freeform, Teacher Liam, Theo is 38, liam is 25, Love Confessions",English,2018-08-09,Completed,2018-08-09,4250,1/1,22,39,2,372,"When Theo meets Liam he's not expecting anything to come of it. He's just a man that brought him coffee. He doesn't even know his name at that point. All he knows is L. They get to know each other when Liam keeps visiting Theo at the hospital he works at, and Theo finds himself falling for him. That only leads to more complications when they have to start dealing with the outside world judging their relationship."
15631389,"Danvers, party of two.",/users/Medium_Range_Trash/pseuds/Medium_Range_Trash,Teen And Up Audiences,F/F,Supergirl (TV 2015),Kara Danvers/Lena Luthor,"Kara Danvers, Lena Luthor","Fluff and Angst, maybe have a box of tissues nearby",English,2018-08-09,Completed,2018-08-09,759,1/1,6,72,3,826,"The story of Kara Danvers and Lena Luthor's life together, told through their visits to National City's finest restaurant."
15631377,Miranda's Tail,/users/Stormashke/pseuds/Stormashke,Not Rated,F/F,The Devil Wears Prada (2006),Miranda Priestly/Andrea Sachs,"Miranda Priestly, Andrea Sachs, Nigel Kipling",,English,2018-08-09,Completed,2018-08-09,4077,1/1,11,77,4,962,What happens when Miranda takes costumes to the next level of Fashion?
15631374,Birds of a Feather,/users/The_Shy_One/pseuds/The_Shy_One,General Audiences,Other,"Loki: Agent of Asgard, All New X-Factor",Remy LeBeau & Loki,"Remy LeBeau, Loki (Marvel), Loki (Agent of Asgard)","Magic, Teleportation, Female Loki (Marvel), Genderfluid Character, Friendship, Male-Female Friendship, They're going out to swindle people, Poker, Fluff",English,2018-08-09,Completed,2018-08-09,1429,1/1,1,4,null,74,Loki finally gets her way with the night she's been wanting. Remy has to wonder how he's gotten here.
15631365,Winter wednesdays,/users/OrangeLovePerson/pseuds/OrangeLovePerson,General Audiences,,Stranger Things (TV 2016),"Eleven | Jane Hopper & Maxine ""Max"" Mayfield","Eleven | Jane Hopper, Maxine ""Max"" Mayfield",,English,2018-08-09,Completed,2018-08-09,731,1/1,null,8,null,67,"Totally random Eleven & Max friendship drabble, just some quality time at the cabin. ^^"
15631362,Girl Crush,/users/Suuz_5_5/pseuds/Suuz_5_5,Teen And Up Audiences,,Chicago Fire,,"Kelly Severide, Stella Kidd","Romance, Songfic, One Shot",English,2018-08-11,Completed,2018-08-11,,1/1,null,null,null,18,"""Hate to admit it but I got a heart rush. Ain't slowing down. I got it real bad."" A song fic inspired by the song Girl Crush by Little Big Town."
15631359,The Stress of a Day,/users/the_sinnamon_roll_writes/pseuds/the_sinnamon_roll_writes,General Audiences,,Hetalia: Axis Powers,America/Germany (Hetalia),"America (Hetalia), Germany (Hetalia)","Canada makes an appearance, a few others do too, but I can't remember who I wrote this a long time ago",English,2018-08-09,Completed,2018-08-09,1051,1/1,2,7,null,58,A meeting gets to be a little much for Alfred's boyfriend.
15631356,eating out of her hands,/users/hashire/pseuds/hashire,Not Rated,F/M,Shingeki no Kyojin | Attack on Titan,Sasha Blouse/Nicolo,"Sasha Blouse, Nicolo (Shingeki no Kyojin), Connie Springer","Cooking, Fluff, Angst, Angst with a Happy Ending, Misunderstandings, Alternate Universe - College/University",English,2018-08-09,Completed,2018-08-09,2807,1/1,6,11,null,null,"In which Nicolo cooks, Sasha eats, and that's all there is to it. Really."
15631353,better than I ever even knew,/users/SecondStarOnTheLeft/pseuds/SecondStarOnTheLeft,Teen And Up Audiences,F/M,A Song of Ice and Fire - George R. R. Martin,Sansa Stark/Willas Tyrell,"Sansa Stark, Willas Tyrell, Tommen Baratheon, Lysa Tully Arryn, Catelyn Tully Stark, Ned Stark, Joffrey Baratheon, Myrcella Baratheon","Alternate Universe - Modern Setting, Mild Sexual Content, Anorexia, POV Alternating",English,2018-08-09,Completed,2018-08-09,4002,1/1,5,73,2,681,"Sansa's made a new life for herself. She's happy, and she's far away from the life she left behind. Until something goes wrong."
