work_id,title,author,rating,category,fandom,relationship,character,additional tags,language,published,status,status date,words,chapters,comments,kudos,bookmarks,hits,summary
15628881,Not so bad,/users/technicrawl/pseuds/technicrawl,General Audiences,F/M,Voltron: Legendary Defender,"Keith/Nyma (Voltron), Hunk/Shay (Voltron)","Keith (Voltron), Nyma (Voltron), Hunk (Voltron), Shay (Voltron)","Autistic Keith (Voltron), kinda lowkey tho, referenced off a high functioning friend of mine so hmu if you see any issues :0, Anxiety, Anxious Keith (Voltron), defensive nyma, good nyma, Hunay, Doritos - Freeform, hunk brings them, thx hunk, Minor Hunk/Shay (Voltron), Human Shay (Voltron), Pining Keith (Voltron), Socially Awkward Keith (Voltron), Keith (Voltron) is a Mess, Hunk (Voltron) is so Pure, Hunk (Voltron) is a Good Friend, hunk is just trying to help, keith is fed up with his shit, shays good keith is ok w her, nyma is hot, i want to fuck nyma",English,2018-08-09,Completed,2018-08-09,1044,1/1,null,2,null,34,"Keith had always lived weeks in the future. He didn't like spontaneous plans or short notice invites, always refusing them and opting to spend time alone, reading a book or working on his bike in the quiet of his home. It made more sense to know when and where something was going to happen, because if he didn't, a mistake could easily be made, and a mistake required an unfortunate amount of backtracking to cleanly fix. His planner was firmly planted in his back pocket, filled ahead in advance for convenience sake.  The reasoning behind it was clear to him, yet to others, it made little sense. They didn't understand why Keith couldn't walk into a store with under ten dollars, or why he walked the opposite direction when a vehicle was at the crosswalk. It was strictly to make his life easier. With twenty dollars, he had the guarantee that he could afford almost anything he wanted once he went inside. Communicating with drivers was an unneeded advance when he could turn around and wait for them to leave. Turning around to leave was easier.  So he did."
15628875,all the time in space,/users/katebishoop/pseuds/katebishoop,General Audiences,Gen,Voltron: Legendary Defender,"Hunk & Keith (Voltron), Keith & Voltron Paladins, Allura & Hunk & Keith & Lance & Pidge | Katie Holt","Keith (Voltron), Hunk (Voltron), Lance (Voltron), Pidge | Katie Holt, Allura (Voltron)","POV Hunk (Voltron), Season/Series 07 Spoilers, Coda, Team Bonding, Friendship",English,2018-08-09,Completed,2018-08-09,1095,1/1,1,56,9,200,There's not much to do but talk when you're stranded in space without your ship. --Based on one of the season 7 preview clips.
15628866,Nightmare Road,/users/caplanbuckybarnes/pseuds/caplanbuckybarnes,Teen And Up Audiences,M/M,Marvel,"James ""Bucky"" Barnes/Thor","Thor (Marvel), James ""Bucky"" Barnes, Pietro Maximoff, Peter Parker, Tony Stark, Steve Rogers","Alternate Universe - College/University, Car Accidents, Nightmares",English,2018-08-09,Completed,2018-08-09,1537,1/1,4,7,null,92,a perfect weekend plan gone horribly wrong.
15628860,Just One Look,/users/stalrua/pseuds/stalrua,Teen And Up Audiences,M/M,Shingeki no Kyojin | Attack on Titan,Levi/Eren Yeager,"Eren Yeager, Levi (Shingeki no Kyojin), Armin Arlert, Erwin Smith, Most of the 104th, Hange Zoe","Drabble Collection, No animals were harmed in the making of this fic, Erwin is Armin's dad, pool parties gone weird, Alternate Universe - Modern Setting",English,2018-08-09,Completed,2018-08-09,2041,1/1,17,100,13,555,"""Um... Armin, what are you doing?"" Armin briefly glanced up from his phone.  ""Hey, Dad.  We're making a sacrifice to the gods.  You know, so all of Eren's deepest darkest dreams come true.""  Beside him, Eren flashed his most winning smile.  For the prompt: ""No ritualistic sacrifice in the pool, kids."""
15628845,Work and Love,/users/Altariel/pseuds/Altariel,General Audiences,Gen,"The Lord of the Rings - J. R. R. Tolkien, TOLKIEN J. R. R. - Works & Related Fandoms",Eowyn/Faramir (Son of Denethor II),Faramir (Son of Denethor II),,English,2018-08-09,Completed,2018-08-09,999,1/1,null,6,null,94,"""Love and work are the cornerstones of our humanness."" Sigmund Freud. Faramir in the Houses of Healing."
15628830,disaster lesbians,/users/mochaslatte/pseuds/mochaslatte,Teen And Up Audiences,"F/F, M/M",Voltron: Legendary Defender,"Allura/Pidge | Katie Holt, Keith/Lance (Voltron), Allura & Keith (Voltron), Allura & Pidge | Katie Holt","Allura (Voltron), Hunk (Voltron), Keith (Voltron), Lance (Voltron), Pidge | Katie Holt, Shiro (Voltron), Matt Holt","Strangers to Friends to Lovers, Magic AU, Modern AU, Lesbian Allura, Lesbian Asexual Pidge, Gay Keith, First Kiss, Getting Together, no beta we die like men, Fluff and Humor, Crack Treated Seriously, Comedy, Suggestive Themes, Sexual Jokes, world building, Allura (Voltron) is a mess, Useless Lesbian Allura, Wingman Keith, Medium Burn, rushed ending, Female Pronouns for Pidge | Katie Holt",English,2018-08-09,Completed,2018-08-09,12139,1/1,1,35,2,467,"So Keith turns into a cat, goes to any place where Pidge is, gets the brunette's attention, and make Pidge brings him to Allura's — the ""owner"" — dorm, and boom! They talk, chat, get to know each other more. Wow, that's fucking great! At least, that's what Allura gets when Keith literally pulled out a whiteboard out of nowhere and explained it to her for about four and a half times (half being Keith forgets where he was so he repeats again). But it really doesn't matter. Because Pidge is straight. Keith flipped the board, ""You useless lesbian,"" Or: Local lesbian tries to get a girlfriend with the help of local gay."
15628824,Apologies for Apologies [Podfic],/users/ReformedTsundere/pseuds/ReformedTsundere,Teen And Up Audiences,M/M,Pu nohiroakademia | Boku no Hero Academia | My Hero Academia,Aizawa Shouta | Eraserhead/Yagi Toshinori | All Might,"Aizawa Shouta | Eraserhead, Yagi Toshinori | All Might, Midoriya Izuku","Eventual Romance, Eventual Smut, classroom teasing, shy might, Podfic, Pod fic, Podfic & Podficced Works, Podfic Length: 20-30 Minutes, erasermight",English,2018-08-09,Completed,2018-08-09,23,1/1,2,5,null,101,"A recording of Apologies for Apologies by Demyrie, part 2 of the Bandages and Bravado series. ""In which, following the events in Aizawa's kitchen, All Might tries to apologize. Again. It goes better, but weirder, than the first time."""
15628818,Sweat,/users/errantknightess/pseuds/errantknightess,Teen And Up Audiences,M/M,D.Gray-man,Lavi/Allen Walker,"Allen Walker, Lavi (D.Gray-man)","working out, Making Out, Drabble",English,2018-08-09,Completed,2018-08-09,955,1/1,4,19,1,105,"Two guys, chilling out in an empty training room zero feet apart because they're working hard on their fighting skills and definitely nothing else."
15628806,Cravings,/users/patry_trusky/pseuds/patry_trusky,Mature,F/M,Law & Order: SVU,"Rafael Barba/Reader, Rafael Barba/You","Rafael Barba, You, Reader","Pregnancy, Pregnant Sex, Oral Sex, Smut",English,2018-08-09,Completed,2018-08-09,1913,1/1,4,19,2,367,You are pregnant and you want Rafael so you go into his home office and try to distract him from work.
15628800,Prince's meal,/users/Mari_Sinpai/pseuds/Mari_Sinpai,Explicit,M/M,The Legend of Zelda: Breath of the Wild,Link/Prince Sidon,"Link (Legend of Zelda), Prince Sidon","ass eating, only ass eating really, Possibly Out of Character, I'm Sorry, this is a gift, Sidon has a tongue to be jealous of oh my god, Idk who I'm more jealous of though do I want to have that tongue or do I want to get that tongue, Mari is a furry",English,2018-08-09,Completed,2018-08-09,627,1/1,null,68,5,837,"There was always something fun about Sidon wanting to try something new. It was enjoyable. For Link, at least; Sidon was so kind and friendly when he asked Link to lie down on his stomach, he could barely bear to tease him any longer.   Sidon is hungry and he wants to try a new dish."
15628794,London Calling,/users/Flynne/pseuds/Flynne,General Audiences,Gen,Mass Effect Trilogy,,"Male Shepard (Mass Effect), Hannah Shepard",idiot cinnamon roll bros,English,2018-08-09,Completed,2018-08-09,848,1/1,null,3,null,25,"Garviel has said his farewells to his squad, but there's one more call he has to make."
15628791,Crossing a Fiery Bridge,/users/Crezhul/pseuds/Crezhul,Teen And Up Audiences,M/M,Pu nohiroakademia | Boku no Hero Academia | My Hero Academia,"Midoriya Izuku/Todoroki Shouto, Todoroki Enji | Endeavor & Todoroki Shouto, Todoroki Fuyumi & Todoroki Shouto","Todoroki Shouto, Midoriya Izuku, Todoroki Enji | Endeavor, Todoroki Fuyumi","Alternate Universe - Canon Divergence, Established Midoriya Izuku/Todoroki Shouto, Romance, Drama, Family Drama, Fluff, Family, Coming Out, Major Manga Spoilers, Father Son Bonding, Sibling Bonding, Experience, Mild Humor, Love, Good Boyfriend, POV Todoroki Shouto, One Shot, Father-Son Relationship",English,2018-08-09,Completed,2018-08-09,2526,1/1,10,122,13,1153,They say that life is about taking risks. Todoroki takes Midoriya home to a family lunch with Endeavour.
15628788,Reunited,/users/NemuiNigen/pseuds/NemuiNigen,General Audiences,M/M,D.Gray-man,Lavi/Allen Walker,"Lavi (D.Gray-man), Allen Walker","laven, hand holding, Cuddling, Domestic Fluff",English,2018-08-09,Completed,2018-08-09,921,1/1,2,11,1,62,Post chapter 230+ drabble imagining Allen and Lavi's reunion night after being separated since their own disappearance and runway efforts.
15628785,Routine,/users/TheWalnutGallery/pseuds/TheWalnutGallery,General Audiences,M/M,"New Dangan Ronpa V3: Everyone's New Semester of Killing, Dangan Ronpa - All Media Types",Momota Kaito/Oma Kokichi/Saihara Shuichi,"Momota Kaito, Oma Kokichi, Saihara Shuichi","saioumotaweek2018, SaiOuMota - Freeform, sweaty boys, Fluff",English,2018-08-09,Completed,2018-08-09,1697,1/1,2,24,3,184,Ouma finally agrees to join Saihara and Momota's nightly workout routine.  Saioumota Week Day 5 - Workout
15628773,elegant and tired,/users/s1357/pseuds/s1357,Teen And Up Audiences,M/M,Stranger Things (TV 2016),Dustin Henderson/Lucas Sinclair,"Lucas Sinclair, Dustin Henderson","Alternate Universe - Teenagers, Fluff",English,2018-08-09,Completed,2018-08-09,606,1/1,null,12,1,67,"Imagine you’re Lucas Sinclair. You’re sitting on your bed, minding your own business as you speak the answers back to Family Feud and flip through a magazine your sister left discarded on the floor.  And then Dustin Henderson rounds the corner."
15628764,to see our glory,/users/sweet_arsenic/pseuds/sweet_arsenic,Mature,M/M,Voltron: Legendary Defender,"Keith/Shiro (Voltron), Keith/Lotor (Voltron)","Keith (Voltron), Lotor (Voltron), Shiro (Voltron), Allura (Voltron), Lance (Voltron), Pidge | Katie Holt, Hunk (Voltron), Coran (Voltron)","Post Season 4, Not Season 5-Compliant, Not Season 6-Compliant, Definitely Not Season 7-Compliant, Angst, Character Death, Keith (Voltron)-centric, Keith's parents are both not alive in this one, the Keitor is one-sided, One-Sided Attraction, Unrequited Love, Hurt/Comfort, Lotor is not completely evil in this one, bec I said so, Dealing With Loss",English,2018-08-09,Completed,2018-08-09,5208,1/1,12,78,20,715,"
“We are going get away from this someday, you and I.” Lotor assures him, hands on either side of Keith's face. “After the battle is won, I will take you to a planet, any planet, far away from any traces of this past. And I will court you, like a proper Galran should, had this war not been in the way.”
"
15628755,For A Moment,/users/mywritingiswack/pseuds/mywritingiswack,General Audiences,F/M,The 100 (TV),"Bellamy Blake/Clarke Griffin, Bellamy Blake/Echo","Bellamy Blake, Clarke Griffin, Echo (The 100)","Season 5 Spoilers, 5x13 spoilers, Canon Universe, Canon Compliant, season 6 spec, bellark - Freeform",English,2018-08-09,Completed,2018-08-09,218,1/1,4,37,3,1033,S6 Bellarke Headcanon based on For A Moment by The Careful Ones. For @greatwanheda on Tumblr
15628752,"""Our precious babies, annoying?!?!?""",/users/LazyGeisha/pseuds/LazyGeisha,General Audiences,M/M,Zhen Hun  | Guardian (TV),Shen Wei/Zhao Yun Lan,Shen Wei/Zhao Yun Lan - Character,"Family, Children",English,2018-08-09,Completed,2018-08-09,154,1/1,9,29,1,174,for j_gabrielleA moment in the park with the Zhao/Shen family
15628749,Heathens,/users/Liz_Night/pseuds/Liz_Night,Teen And Up Audiences,M/M,Star Wars - All Media Types,Obi-Wan Kenobi/Anakin Skywalker,"Obi-Wan Kenobi, Anakin Skywalker, Padme Amidala, Qui-Gon Jinn",gray au,English,2018-08-09,Completed,2018-08-09,6817,1/1,10,49,2,417,"For Obikin Week Day Eight: Free DayAt the Battle of Naboo, Obi-Wan falls to the dark side. Qui-Gon pleads for him to choose the Gray instead of becoming a Sith. Years later, Obi-Wan finds Anakin again while trying to derail the coming war."
15628743,that thing (my soul) was a lost star,/users/nea_writes/pseuds/nea_writes,Teen And Up Audiences,,D.Gray-man,Kanda Yuu & Allen Walker,Alma Karma,"Canon Universe, Hurt/Comfort, Grief/Mourning, Character Development",English,2018-08-09,Completed,2018-08-09,2299,1/1,2,31,6,143,"Kanda had never been kind to Allen, and despite knowing Allen wanted nothing more than to break where no one could see him, Kanda would not allow him that dignity. It was only fair, after all, that he do the same thing to Allen that Allen did to him. Forever meddling and sacrificing and crying and never ever giving up no matter how Kanda tried, even when he’d fatally stabbed Allen and still taken all he could from him, a price too much to pay for a solace Kanda never knew he could attain."
15628740,A guardian's battles,/users/Duncan_the_king_of_basketball/pseuds/Duncan_the_king_of_basketball,Not Rated,,Pu nohiroakademia | Boku no Hero Academia | My Hero Academia,,"Original Characters, Dabi (My Hero Academia), Kurogiri (My Hero Academia), Shigaraki Tomura | Shimura Tenko, Original Quirks","Other Additional Tags to Be Added, Competition",English,2018-08-09,Completed,2018-08-09,1477,1/1,null,null,null,7,"In this fanfiction, the characters from my other story will face off against characters from the original universe. There will be heroes, villains, 1A, maybe even 1B Characters fighting in this fic. And, if you wish, you can comment who you think, should get another fight, as well as their potential enemy."
15628734,Dance and everything else,/users/Kiichigo/pseuds/Kiichigo,Explicit,F/M,bangtansonyeondan | Bangtan Boys | BTS,Park Jimin (BTS)/Reader,"Park Jimin (BTS), female!reader","Plot What Plot/Porn Without Plot, Established Relationship, Oral Sex, Fluff and Smut, Smut",English,2018-08-09,Completed,2018-08-09,2934,1/1,null,10,1,259,"[from AU] Park Jimin is your boyfriend and you both attend Juilliard University in New York as dance majors. The story shows your and Jimin's morning before you head of to your practice room, where you spend many hours perfecting your performance before auditions. This story happens immediately after the original poster had left. Smutty fluff ahead!"
15628731,Pity Does Not Lie Here,/users/I_am_a_Ruin/pseuds/I_am_a_Ruin,Not Rated,,Voltron: Legendary Defender,,"Lance (Voltron), Pidge | Katie Holt, Hunk (Voltron), Shiro (Voltron), Keith (Voltron)","potential very triggering, Trigger Warnings, Hurt/Comfort, Angst, Anorexia, Unhealthy Coping Mechanisms, Fainting, Hunk is best boy, The others want to do their best, Langst, still surprised that's not a tag tbh, Lance: anorexia, lots of bad thoughts, this is kinda crap",English,2018-08-09,Completed,2018-08-09,2326,1/1,4,63,3,512,"Ignore that title. It was created under a time limit! Basically just read the tags and tread carefully. Thanks. Lance is not okay, even though he says otherwise."
15628728,What Ted Saw,/users/badly_knitted/pseuds/badly_knitted,Explicit,M/M,FAKE (Manga),"Dee Laytner/Randy ""Ryo"" MacLean","Ted (FAKE), Dee Laytner, Randy ""Ryo"" MacLean","Shameless Smut, Hand Jobs, Workplace Relationship, Workplace Sex, Accidental Voyeurism, Smut, Fluff and Smut",English,2018-08-09,Completed,2018-08-09,1060,1/1,2,1,1,42,Ted just wanted something from the file room…
15628725,"Another Time, Another Place",/users/SeaAriel1987/pseuds/SeaAriel1987,General Audiences,Gen,Dragon Age (Video Games),,"Original Characters, Flemeth (Dragon Age)","Alternate Universe - Canon Divergence, Eluvians",English,2018-08-09,Completed,2018-08-09,1812,1/1,null,1,null,14,"Beginning of my tale of three sisters who find themselves in Thedas at different times and places, ripped apart with no memory of each other.  What will await them?"
15628722,The One With The Shaving,/users/Shimerz/pseuds/Shimerz,Explicit,M/M,"Warcraft (2016), Warcraft - All Media Types",Khadgar/Anduin Lothar,"Khadgar (Warcraft), Anduin Lothar","Liontrust Week 2018, Day 5 - consent, LionTrust, Shaving, Straight-blade (for shaving only), The Stache",English,2018-08-09,Completed,2018-08-09,1237,1/1,4,10,null,112,"Lothar wants to shave Khadgar - he is due for a trim. Sexy times ensue. (Khadgar is definitely movie Khadgar, unlike my other Liontrust Week fics.)"
15628716,What Are You Doing With All Of My Tax Dollars?,/users/whaleofatime/pseuds/whaleofatime,General Audiences,"Gen, M/M",Voltron: Legendary Defender,"Keith/Shiro (Voltron), Allura & Coran & Hunk & Keith & Lance & Pidge | Katie Holt & Shiro","Keith (Voltron), Shiro (Voltron), Hunk (Voltron), Lance (Voltron), Pidge | Katie Holt","College AU, Where the Forces of Evil are asshole parents, Shiro (Voltron) Has PTSD - Post-Traumatic Stress Disorder, But nevertheless he does his best, au yeah august",English,2018-08-09,Completed,2018-08-09,2512,1/1,6,38,9,203,"Local entitled idiot asks Shiro, head of the beleaguered administration staff of a small, deeply underfunded public university. The answer, it turns out, is whatever it takes (to take care of each other).    VLD College Staff AU"
15628713,RWBY: Trial and Error (BlackSun),/users/Kirimizi/pseuds/Kirimizi,Teen And Up Audiences,F/M,RWBY,"Blacksun - Relationship, Blake Belladonna/Sun Wukong, Eclipse - Relationship","Blake Belladonna, Sun Wukong","Romance, Angst, Thank You All, for the patience you had with me, seeing the emails of comments, and the like, made my heart fight a lil harder",English,2018-08-09,Completed,2018-08-09,816,1/1,null,6,null,78,"Blake needs Sun to understand what defines consequences, and that she can fight her own battles. Still, maybe she will learn it’s okay to have people help fight beside you.  (One of two parts! Taking my time getting back into the swing of things!)"
15628710,Letters to Matt,/users/technicrawl/pseuds/technicrawl,General Audiences,Other,Voltron: Legendary Defender,"Matt Holt & Pidge | Katie Holt, Pidge | Katie Holt & Pidge | Katie Holt's Family, Matt Holt & Pidge | Katie Holt's Family","Matt Holt, Shiro (Voltron), Matt Holt (Voltron), Pidge | Katie Holt, Pidge | Katie Holt's Family, Colleen Holt, Samuel Holt, Bae Bae (Voltron)","space, idk man. pidge's letters to matt while hes in space being held captive, season 4 - 7 spoilers, Letters, emo shit, Mentions of Other Voltron Paladins, Voltron, Female Pronouns for Pidge | Katie Holt, Female Pidge | Katie Holt, Pidge | Katie Holt-centric, Matt Holt has PTSD - Post-Traumatic Stress Disorder, Rebel Matt Holt, Mentioned Matt Holt",English,2018-08-09,Completed,2018-08-09,1106,1/1,null,8,null,68,"dear Matt, today you went into space."
15628704,The Brightest,/users/Destinyrays023/pseuds/Destinyrays023,General Audiences,F/M,"Fruits Basket, Fruits Basket - Takaya Natsuki (Manga), Fruits Basket (Anime)",Honda Tohru/Sohma Kyou,"Honda Tohru, Sohma Kyou, Sohma Yuki","Fluff, Oneshot, Fluff and Hurt/Comfort, Romance",English,2018-08-09,Completed,2018-08-09,706,1/1,null,3,null,26,Sometimes you don't realize how much you truly shine [Kyo and Tohru] *oneshot*
15628695,Alfred Makes a Friend,/users/FrozenLakeBeast/pseuds/FrozenLakeBeast,General Audiences,Gen,Hetalia: Axis Powers,America & Russia (Hetalia),"America (Hetalia), Russia (Hetalia)","Literature, fan fiction, General fiction",English,2018-08-09,Completed,2018-08-09,3649,1/1,null,1,null,16,
15628689,Down Here On My Knees,/users/GotTheSilver/pseuds/GotTheSilver,Mature,M/M,Marvel Cinematic Universe,Steve Rogers/Tony Stark,"Steve Rogers, Tony Stark, James ""Bucky"" Barnes, Natasha Romanov (Marvel)","Post-Avengers: Infinity War Part 1 (Movie), Mutual Pining, Getting Together, Forgiveness, Community: trope_bingo, Relationship Negotiation",English,2018-08-09,Completed,2018-08-09,5142,1/1,20,235,41,2154,"
“What is it?” Tony asks, taking his seat again.  He pushes his chair back and swings his legs up onto the table in an attempt to put some distance between them.
 
“We haven’t talked,” Steve says, forearms resting on the table as he leans forward like he’s trying to close the gap between them.  “I thought—”
 
“No,” Tony interrupts.  “We don’t need to.”
 
Steve looks down between his hands, and when Tony glances over at him, he can see the furrow on his brow.  “I think we do,” Steve says quietly.  “We can’t—I can’t go on like this.”
"
15628677,True Intensity,/users/OscarApollo/pseuds/OscarApollo,Not Rated,M/M,The Mayor of Casterbridge,Michael Henchard/Donald Farfrae (unrequited),"Michael Henchard, Donald Farfrae","Canon, Thomas Hardy - Freeform, Victorian Literature, Wessex - Freeform, Wessex Novels",English,2018-08-09,Completed,2018-08-09,2732,1/1,null,null,null,1,"Henchard hadn't felt such a connection before in his life. It was strange, then, how quickly this feeling had bloomed for a complete stranger; and it was utterly cruel how this man could never feel the same way for him. A story taking place within the canon of novel, exploring homoerotic feelings on Henchard's part for Farfrae."
15628668,tagu-taguan,/users/riakkuma/pseuds/riakkuma,Not Rated,M/M,EXO (Band),"Byun Baekhyun/Park Chanyeol, Byun Baekhyun & Park Chanyeol","Park Chanyeol, Byun Baekhyun, Oh Sehun, Kim Minseok, Kim Jongdae, EXO - Character","tagalog fic, Angst, Tagalog!au, College/University, Romance, Alternate Universe, ano pa bang ilalagay ko, One Sided Love",English,2018-08-09,Completed,2018-08-09,2337,1/1,1,2,null,92,"chanyeol loves to make kwento about his love, but baekhyun doesn’t hear him."
15628644,I.A.N.T.O.,/users/badly_knitted/pseuds/badly_knitted,Teen And Up Audiences,Gen,Torchwood,,"Jack Harkness, Suzie Costello, Owen Harper, Toshiko Sato, Ianto Jones","Community: beattheblackdog, Alternate Universe - Robots & Androids, Torchwood One, Post-Episode AU: s02e13 Doomsday, Episode AU: s02e12 Army of Ghosts, Angst, Torchwood Three, Alternate Universe - Canon Divergence, Pre-Season/Series 01, Drama",English,2018-08-09,Completed,2018-08-09,3489,1/1,4,22,2,139,Jack is thrilled to finally get his hands of a very impressive piece of tech developed by Torchwood One.
15628638,Qiong Ding,/users/Yutong20/pseuds/Yutong20,Not Rated,M/M,Lei Qia ,,,,English,2018-08-09,Completed,2018-08-09,265,1/1,null,9,null,467,
15628632,Summer Slipped Us Underneath Her Tongue,,Explicit,M/M,Polygon/McElroy Vlogs & Podcasts RPF,Brian David Gilbert/Patrick Gill,"Brian David Gilbert, Patrick Gill","PWP, Sex Toys, Bottom Brian, top pat",English,2018-08-09,Completed,2018-08-09,2889,1/1,5,23,1,227,"
 Brian wants to do things to Pat, things with Pat with an intensity and shamelessness heretofore unknown to him; feels like Pat's unlocked a part of him he didn't even know existed. 
"
15628620,A Loner's Request,/users/asurora_san/pseuds/asurora_san,General Audiences,F/M,Dao Jian Luan Wu  | Touken Ranbu,ookurikara/female aruji,Ookurikara (Touken Ranbu),"Fluff, Cuddling & Snuggling, lonely, nihongo - Freeform, Samurai",English,2018-08-09,Completed,2018-08-09,704,1/1,null,2,null,38,Even those who choose to be alone get lonely sometimes...and who else better understands than Aruji.
15628599,Homewarming,/users/SylvaneDaScribe/pseuds/SylvaneDaScribe,Explicit,M/M,Elder Scrolls V: Skyrim,,"dee-ja, hands-in-flames","m/m - Freeform, Master/Servant, Anal Sex, Oral Sex, Power Bottoming",English,2018-08-09,Completed,2018-08-09,2792,1/1,2,1,null,65,"Small break from the usual narrative slow of Dragon Contract to check in on Deej and Hands, the blacksmith and his apprentice from Winterhold."
15628593,Sweet Darlin',/users/Agent17/pseuds/Agent17,Mature,M/M,Rogue One: A Star Wars Story (2016),Cassian Andor/Bodhi Rook,"Cassian Andor, Bodhi Rook, Chirrut Imwe, Baze Malbus, Jyn Erso, Kes Dameron","Alternate Universe - Modern Setting, Angst, Angst with a Happy Ending, Fluff and Angst, Fluff and Smut, Dog K-2SO, Minor Chirrut Imwe/Baze Malbus",English,2018-08-09,Completed,2018-08-09,10606,1/1,6,13,1,81,"Sometimes, without meaning to, it's possible to hurt the ones you love. In which Cassian needs to learn to recognize his feelings before Bodhi becomes that one."
15628590,Hippie And The Cool,/users/CleoBane/pseuds/CleoBane,General Audiences,M/M,"Jimon - Fandom, The Shadowhunter Chronicles - All Media Types",Simon Lewis/Jace Wayland,"Jace Wayland, Simon Lewis, Magnus Bane, Alec Lightwood, Madzie Lightwood-Bane","Kids, Discipline, Responsibility, irresponsibilty, Established Relationship, Married Jimon, Cool Uncles, They Aren't Ready For Kids",English,2018-08-09,Completed,2018-08-09,987,1/1,4,30,4,253,Simon and Jace aren't quite ready for kids. But they do enjoy being the cool uncles to the kids they babysit...
